date,username,to,replies,retweets,favorites,text,geo,mentions,hashtags,id,permalink
2019-02-07 15:19:08,CoinDesk,,17,196,586,". @Ripple has partnered another 10 top universities for its international blockchain research program, bringing the total to 29. http://ow.ly/v1Kg30nCfU5",,@Ripple,,1093529600381079554,https://twitter.com/CoinDesk/status/1093529600381079554
2019-01-27 22:55:07,CoinDesk,,19,150,441,"Ripple has partnered with a top Chinese university for a blockchain research program. http://ow.ly/XUH230nsmEU",,,,1089658086191779841,https://twitter.com/CoinDesk/status/1089658086191779841
2019-01-24 18:48:28,CoinDesk,,44,133,317,"UPDATE: Ripple responds: ""Not only does this report contain several inaccurate assumptions around lockups and selling restrictions, the entire report is based on an incorrect calculation of market cap."" http://ow.ly/XpOq30nrhV9",,,,1088508850318331904,https://twitter.com/CoinDesk/status/1088508850318331904
2019-01-23 13:32:52,CoinDesk,,4,114,361,". @Ripple has teamed up with a top Chinese university for a research program focused on blockchain development and regulation. http://ow.ly/f6T830nq5YF",,@Ripple,,1088067040303296513,https://twitter.com/CoinDesk/status/1088067040303296513
2019-01-08 20:47:20,CoinDesk,,36,421,1059,"Euro Exim Bank is tapping Ripple's xRapid product, which uses the XRP cryptocurrency, for payments and settlements. http://ow.ly/N79v30neSsI",,,,1082740559884795904,https://twitter.com/CoinDesk/status/1082740559884795904
2018-12-28 09:21:30,CoinDesk,,11,275,679,"National Bank of Kuwait has joined Ripple’s blockchain-based payments network seeking faster cross-border money transfers. http://ow.ly/2Ufm30n7z0B",,,,1078581697715810304,https://twitter.com/CoinDesk/status/1078581697715810304
2018-12-27 10:01:22,CoinDesk,,2,42,84,"There will be opportunities for smart blockchain companies that can find their niche in the coming unbundling, says Ripple's Asheesh Birla. http://ow.ly/M3IC30n6Yk2 #Crypto2018",,,#Crypto2018,1078229343564906496,https://twitter.com/CoinDesk/status/1078229343564906496
2018-12-19 20:10:18,CoinDesk,,83,44,101,"At #ConsensusInvest, @laurashin talked about #Ripple: ""They're definitely one of the leaders when it comes to enterprise #blockchain."" Watch more: http://ow.ly/J7pz30n2mn8 pic.twitter.com/iKcOxasqhC",,@laurashin,#ConsensusInvest #Ripple #blockchain,1075483481105416192,https://twitter.com/CoinDesk/status/1075483481105416192
2018-12-13 12:03:35,CoinDesk,,17,168,418,"Abu Dhabi-based money transmitter UAE Exchange is working with Ripple to launch blockchain remittances to Asia early next year. http://ow.ly/srus30mYhLd",,,,1073186668541288448,https://twitter.com/CoinDesk/status/1073186668541288448
2018-12-11 16:17:13,CoinDesk,,14,149,381,"South Korean crypto exchange Coinone has launched Cross, an app providing cross-border remittances using Ripple's xCurrent product. http://ow.ly/6SsS30mWJUT",,,,1072525720918867968,https://twitter.com/CoinDesk/status/1072525720918867968
2018-12-01 23:10:06,CoinDesk,,28,254,639,"Ripple is rolling out a new version of its most popular product, xCurrent. http://ow.ly/TNFG30mORLr",,,,1069005748728926208,https://twitter.com/CoinDesk/status/1069005748728926208
2018-11-26 16:02:01,CoinDesk,,13,174,464,"Security token startup Securitize has raised $12.75 million in Series A funding backed by Coinbase Ventures and Ripple's Xpring, among others. http://ow.ly/FIku30mKMaE",,,,1067086079373787136,https://twitter.com/CoinDesk/status/1067086079373787136
2018-11-26 09:08:24,CoinDesk,,38,174,458,"Ripple's new version of xCurrent offers easier integration with xRapid, the product that leverages XRP. But so far, customers who've upgraded aren't taking the plunge. http://ow.ly/ELa430mKmzg",,,,1066981988236754945,https://twitter.com/CoinDesk/status/1066981988236754945
2018-11-17 16:25:05,CoinDesk,,24,80,140,"An ongoing legal battle between XRP investors and payments startup Ripple is entering its next phase. http://ow.ly/MPRK30mEG0L",,,,1063830394146033670,https://twitter.com/CoinDesk/status/1063830394146033670
2018-11-15 13:03:28,CoinDesk,,26,319,852,"Malaysian banking group CIMB has joined Ripple’s blockchain-based payments network, RippleNet, seeking faster cross-border payments. http://ow.ly/IEyQ30mCYOh",,,,1063054880640823296,https://twitter.com/CoinDesk/status/1063054880640823296
2018-10-29 16:04:16,CoinDesk,,10,159,388,"Blockchain payments startup Ripple has hired Google's former messaging lead as its vice president of products. http://ow.ly/8QWO30mpNuy",,,,1056939786576019457,https://twitter.com/CoinDesk/status/1056939786576019457
2018-10-28 10:02:01,CoinDesk,,20,130,303,"The Model T democratized the car industry – and the bitcoin white paper did the same for payments, says Ripple's top technologist, David Schwartz. http://ow.ly/EITA30moUyR",,,,1056486233759797248,https://twitter.com/CoinDesk/status/1056486233759797248
2018-10-25 16:45:58,CoinDesk,,26,123,363,"Ripple more than doubled its XRP sales quarter-over-quarter, though it did not match Q1 sales, according to its latest markets report. http://ow.ly/3m4m30mne3f",,,,1055500727152508928,https://twitter.com/CoinDesk/status/1055500727152508928
2018-10-18 20:22:47,CoinDesk,,8,44,99,"Ripple's head of information security is leaving the company to join token startup Harbor. http://ow.ly/Epk130mhYl3",,,,1053018575244587008,https://twitter.com/CoinDesk/status/1053018575244587008
2018-10-18 14:07:11,CoinDesk,,23,441,982,"The Bill and Melinda Gates Foundation has partnered with Coil, a startup founded by Ripple's former CTO, to provide payment services for the unbanked. http://ow.ly/5eY930mhCFB",,,,1052924055358267392,https://twitter.com/CoinDesk/status/1052924055358267392
2018-10-12 17:09:33,CoinDesk,,58,60,195,"#XRP or #RIPPLE? It was a big year for #xrpthestandard, but who was more influential to its success, the #XRPArmy or the biggest company backing it? VOTE: http://ow.ly/hRZw30md2VJ pic.twitter.com/7G4dtWHvEC",,,#XRP #RIPPLE #xrpthestandard #XRPArmy,1050795621148491777,https://twitter.com/CoinDesk/status/1050795621148491777
2018-10-06 21:50:07,CoinDesk,,16,204,565,"FEATURE: After a series of highly-publicized pilots, three companies are now making commercial use of Ripple's xRapid product. http://ow.ly/29r730m7AIj",,,,1048691900126048256,https://twitter.com/CoinDesk/status/1048691900126048256
2018-10-06 08:40:07,CoinDesk,,82,104,301,"Former U.S. President @BillClinton didn't have to say much when he delivered the keynote at Ripple's Swell conference in San Francisco. And indeed, he barely said anything relevant to the #blockchain industry.http://ow.ly/4Q7g30m7AMg",,@BillClinton,#blockchain,1048493089244033024,https://twitter.com/CoinDesk/status/1048493089244033024
2018-10-04 09:02:17,CoinDesk,,17,202,508,"MoneyTap, a blockchain money transfer app built by SBI Holdings and Ripple, has just launched in Japan. http://ow.ly/dSmD30m5Rxe",,,,1047773894667583488,https://twitter.com/CoinDesk/status/1047773894667583488
2018-10-03 14:01:47,CoinDesk,,7,34,107,"Ripple's ""800-pound gorilla"" in the room is whether financial institutions will actually use cryptocurrencies in cross-border payments. http://ow.ly/Ffl330m56SQ",,,,1047486879032070144,https://twitter.com/CoinDesk/status/1047486879032070144
2018-10-02 21:02:26,CoinDesk,,4,11,40,"Future of #blockchain panel at #SwellbyRipple with Kahina Van Dyke, SVP at @ripple; Amy Radin, author of ""The Change Maker's Playbook""; 'Tokunboh Ishmael, chair of the African Venture Capital Association; Ben Brabyn, head of Level39 @tolushola @BenBrabyn @kahinavandyke @AmyRadinpic.twitter.com/oiT9KAwA06",,@ripple @tolushola @BenBrabyn @kahinavandyke @AmyRadinpic,#blockchain #SwellbyRipple,1047230350185750528,https://twitter.com/CoinDesk/status/1047230350185750528
2018-10-02 20:24:24,CoinDesk,,1,10,33,". @fepavani: ""If you're going to change your legacy technology of a bank or your business, it's scary."" @ripple ""came to us and said, okay let's present to you what is going to change and how you're going to implement"" #SwellbyRipple",,@fepavani @ripple,#SwellbyRipple,1047220779379613696,https://twitter.com/CoinDesk/status/1047220779379613696
2018-10-02 20:08:14,CoinDesk,,5,49,129,"Dinn: ""It's going to be very hard for a bank to exist in the next five to eight years … we're looking at how we're going to make ourselves relevant,"" so ""we needed a company … that we could grow aggressively with"" – ie, @ripple #SwellbyRipple",,@ripple,#SwellbyRipple,1047216709180973057,https://twitter.com/CoinDesk/status/1047216709180973057
2018-10-02 18:43:13,CoinDesk,,2,10,51,"As for #cryptocurrency, @rjpittman said, ""for me crypto's a little different story – I love the promise – and I think cryptocurrency as a bridge currency is one of the best first use cases"" as a ""lubricant in the flywheel of cross-border trade"" @ripple",,@rjpittman @ripple,#cryptocurrency,1047195315080577025,https://twitter.com/CoinDesk/status/1047195315080577025
2018-10-02 18:22:54,CoinDesk,,1,9,38,"Next up at #SwellbyRipple: Robert Hackett, senior writer at Fortune, and R.J. Pittman, former chief product officer at eBay @rhhackett @rjpittman @ripple pic.twitter.com/ezZ1hO6oMe",,@rhhackett @rjpittman @ripple,#SwellbyRipple,1047190201208958976,https://twitter.com/CoinDesk/status/1047190201208958976
2018-10-02 18:13:56,CoinDesk,,1,21,49,". @MichaelSDidiuk on the potential for a surprise SEC decision on a given #cyrptocurrency: ""If something that for three or four years everyone's been treating like a currency is suddenly deemed a security, it's going to have ripple effects – no pun intended."" #SwellbyRipple",,@MichaelSDidiuk,#cyrptocurrency #SwellbyRipple,1047187946653114368,https://twitter.com/CoinDesk/status/1047187946653114368
2018-10-02 18:08:28,CoinDesk,,3,11,35,"See here for background on what the Howey Test is and why the question of @ripple's involvement is relevant for #XRPhttps://www.coindesk.com/simplest-way-understand-dao-security/ …",,@ripple,#XRPhttps,1047186571127009280,https://twitter.com/CoinDesk/status/1047186571127009280
2018-10-02 18:01:27,CoinDesk,,11,227,480,". @MichaelSDidiuk, who spent 8 years at the SEC: ""I don't think #XRP is a security, I think XRP is a currency. And the reason why"" is the Howey Test: ""you have to satisfy all four prongs"" and ""with XRP, @ripple could go away and XRP would still exist."" #SwellbyRipple",,@MichaelSDidiuk @ripple,#XRP #SwellbyRipple,1047184803399852032,https://twitter.com/CoinDesk/status/1047184803399852032
2018-10-02 17:57:02,CoinDesk,,1,6,29,"Leckow: ""obviously this space is going to continue to grow … we should not underestimate the changes that will be needed to the legal framework outside of regulation"" @ripple @IMFNews",,@ripple @IMFNews,,1047183691867254784,https://twitter.com/CoinDesk/status/1047183691867254784
2018-10-02 17:37:03,CoinDesk,,3,15,54,"Lawsky created the #BitLicense crypto regulation during his time at New York's Department of Financial Services. Ripple became one of a handful of firms to get a BitLicense in 2016. @BenLawsky joined @ripple's board in late 2017 @NYDFShttps://www.coindesk.com/bitlicense-architect-ben-lawsky-joins-ripple-board/ …",,@BenLawsky @ripple @NYDFShttps,#BitLicense,1047178661948866560,https://twitter.com/CoinDesk/status/1047178661948866560
2018-10-02 17:26:37,CoinDesk,,2,17,60,". @CoryTV says the value of ""cyrptocurrency – I use that term almost pejoratively … will be in their use, not in their scarcity or as a quote-on-quote store of value."" He adds @ripple is ""further along"" in terms of use cases ""than any company out there"" #SwellbyRipple",,@CoryTV @ripple,#SwellbyRipple,1047176036805275649,https://twitter.com/CoinDesk/status/1047176036805275649
2018-10-02 17:14:53,CoinDesk,,2,7,29,". @asgrealish: some incumbents are saying ""pre-funding is a necessary evil."" But they're staring to come around: ""They're in a groove, they're recognizing that it could become a rut."" @Ripple pic.twitter.com/DGqEsJs7hC",,@asgrealish @Ripple,,1047173083633672192,https://twitter.com/CoinDesk/status/1047173083633672192
2018-10-02 17:11:22,CoinDesk,,3,50,171,". @CoryTV: ""There’s $10 trillion dollars just sitting in nostro accounts, just waiting to be used … that inefficient use just cannot last in this modern economy."" He adds, ""we are right on the cusp of mass adoption based on our survey results"" @Ripple",,@CoryTV @Ripple,,1047172197809176576,https://twitter.com/CoinDesk/status/1047172197809176576
2018-10-02 17:09:34,CoinDesk,,3,11,55,"Cory Johnson, chief market strategist at @ripple, and Alenka Grealish, senior analyst at @Celent_Research, on stage sharing proprietary research and answering the question: ""when are we not going to be the weirdos anymore?"" #blockchain @CoryTV #SwellbyRipplepic.twitter.com/0e8ykQt4WF",,@ripple @Celent_Research @CoryTV,#blockchain #SwellbyRipplepic,1047171747705831424,https://twitter.com/CoinDesk/status/1047171747705831424
2018-10-02 17:05:16,CoinDesk,,17,154,524,"#SwellbyRipple day two is underway in San Francisco with @ripple CEO @bgarlinghouse taking the stage: ""If we are solving real problems for customers, if we're doing it in a regulatory-compliant way … we're seeing governments around the world lean in""pic.twitter.com/MWl9uJA5Hp",,@ripple @bgarlinghouse,#SwellbyRipple,1047170665483198464,https://twitter.com/CoinDesk/status/1047170665483198464
2018-10-01 21:24:52,CoinDesk,,3,23,98,"On stage now: Dilip Rao, @ripple's global head of infrastructure innovation; Mohsen Alzahrani, the Saudi Arabian Monetary Authority's head of innovation; Andrew McCormick, Payments Canada's VP of payments and technology; and Marcelo Yared, CIO of Banco Central do Brasil pic.twitter.com/FlA20rLkU3",,@ripple,,1046873607538786304,https://twitter.com/CoinDesk/status/1046873607538786304
2018-10-01 20:54:22,CoinDesk,,4,23,90,". @sabharwals: the cost of person-to-person remittances is 7.5 percent. With #DLT (read, blockchain), ""you can see how that 7.5 percent can come down significantly"" and @ripple is ""on the forefront"" in making that happen",,@sabharwals @ripple,#DLT,1046865932079980545,https://twitter.com/CoinDesk/status/1046865932079980545
2018-10-01 20:37:53,CoinDesk,,2,32,119,"""What we did with @Ripple was we created a number of proofs of concepts, pilots in our markets … based on the success of those pilots, in April of this year we launched One Pay FX"" in the UK, Spain, Brazil, Poland. One Pay FX is ""a Ripple-based international payments service.""",,@Ripple,,1046861784714436608,https://twitter.com/CoinDesk/status/1046861784714436608
2018-10-01 20:28:40,CoinDesk,,8,104,291,"Just announced: ""We are moving #xRapid into production … we've just done our first production payments with Cuallix into Mexico."" xRapid is Ripple's product that leverages the cryptocurrency #XRP for cross-border payments @bgarlinghouse @Ripple https://www.coindesk.com/ripple-event-reveal-3-companies-are-now-using-xrp-for-real-payments/ …",,@bgarlinghouse @Ripple,#xRapid #XRP,1046859461803962368,https://twitter.com/CoinDesk/status/1046859461803962368
2018-10-01 20:26:43,CoinDesk,,5,35,117,"""Our vision is to truly enable global payments … such that it is real-time and extremely low cost."" Along with that, @Ripple aims for ""a dramatic reduction in the error rate"" and an ""elegant experience"" for customers (a few of which are shown in the slide below) pic.twitter.com/bKAKRiURt9",,@Ripple,,1046858974149074946,https://twitter.com/CoinDesk/status/1046858974149074946
2018-10-01 20:16:53,CoinDesk,,2,16,89,"""How do we think about not passing 50 cents but fractions of a cent? How do we enable this #InternetofValue? … I think we are still in the earliest days of #blockchain technology … Ripple is unique because we have real live use cases."" @bgarlinghouse",,@bgarlinghouse,#InternetofValue #blockchain,1046856497353773057,https://twitter.com/CoinDesk/status/1046856497353773057
2018-10-01 20:14:14,CoinDesk,,1,24,126,"""When Ripple is building, we think about the shipping container as a metaphor for interoperability."" Cargo containers enabled interoperability between trains, ships, trucks, led to 700% increase in global trade #SwellbyRipple @Ripple",,@Ripple,#SwellbyRipple,1046855830014812160,https://twitter.com/CoinDesk/status/1046855830014812160
2018-10-01 20:12:39,CoinDesk,,45,252,816,"Ripple CEO @bgarlinghouse: ""Silicon Valley loves to talk about disruption … at the end of the day sometimes disruption is exactly what you don't need."" For Ripple, ""It wasn't about replacing banks … there's an opportunity to be a builder and partner with the industry."" pic.twitter.com/p3TtESImAB",,@bgarlinghouse,,1046855431002382337,https://twitter.com/CoinDesk/status/1046855431002382337
2018-10-01 20:01:50,CoinDesk,,29,465,1074,"JUST IN: After a series of highly-publicized pilots, three companies – MercuryFX, Cuallix and Catalyst Corporate Credit Union – are now making commercial use of Ripple's xRapid product. http://ow.ly/9Nai30m3lcj",,,,1046852710350426112,https://twitter.com/CoinDesk/status/1046852710350426112
2018-10-01 17:56:30,CoinDesk,,7,27,85,"Ripple CEO @bgarlinghouse takes the to introduce @BillClinton: ""The Clinton administration really set the foundation for the growth of the internet as we see it today. I believe that we are in the same place with blockchain technologies."" #SwellbyRipple",,@bgarlinghouse @BillClinton,#SwellbyRipple,1046821168697802753,https://twitter.com/CoinDesk/status/1046821168697802753
2018-10-01 17:30:00,CoinDesk,,45,134,416,"Former US President @BillClinton will take the stage at Ripple's Swell conference in 30 minutes. Follow along here for up-to-the-minute coverage live from San Francisco: #SwellbyRipplepic.twitter.com/e6oMJo4rNN",,@BillClinton,#SwellbyRipplepic,1046814501557993472,https://twitter.com/CoinDesk/status/1046814501557993472
2018-09-29 11:30:19,CoinDesk,,44,329,705,"Ripple is leading a group of organizations launching an advocacy body in Washington D.C. that will pay for lobbying in both U.S. dollars and XRP. http://ow.ly/nNFP30m1BKx",,,,1045999207348404225,https://twitter.com/CoinDesk/status/1045999207348404225
2018-09-26 09:03:31,CoinDesk,,21,318,733,"A joint venture between SBI Holdings and Ripple has taken a step closer to launching its blockchain-based payments app for consumers. http://ow.ly/6hvQ30lYzWQ",,,,1044875101831868419,https://twitter.com/CoinDesk/status/1044875101831868419
2018-09-19 14:02:02,CoinDesk,,19,234,527,"JUST IN: PNC Bank's Treasury Management division is to begin accepting cross-border transactions using Ripple's xCurrent product. http://ow.ly/QvOY30lSU13",,,,1042413510163144704,https://twitter.com/CoinDesk/status/1042413510163144704
2018-09-17 23:30:20,CoinDesk,,12,92,278,"In an interview with @CNBC, a representative of @Ripple hinted at the release of a new product xRapid in the future. http://ow.ly/pZsu50iTrF4",,@CNBC @Ripple,,1041831753474818049,https://twitter.com/CoinDesk/status/1041831753474818049
2018-09-14 07:28:25,CoinDesk,,7,74,203,"Having revealed the plan in March, Japan's SBI Holdings says it will roll out a Ripple DLT-based payments app for iOS and Android this autumn. http://ow.ly/CtGW30lOG2c",,,,1040502514775408640,https://twitter.com/CoinDesk/status/1040502514775408640
2018-09-11 14:03:50,CoinDesk,,8,84,211,"Blockchain startups Ripple and R3 have resolved a legal battle that saw both firms filing suits in the U.S. over a contract dispute. http://ow.ly/nI1u30lLZTx",,,,1039514858281029632,https://twitter.com/CoinDesk/status/1039514858281029632
2018-09-10 17:17:37,CoinDesk,,4,21,62,"NEW GIG: Ripple's former general counsel Brynly Llyr is taking on the same role for crypto payments startup Celo. http://ow.ly/WR4v30lLaQa",,,,1039201240125775872,https://twitter.com/CoinDesk/status/1039201240125775872
2018-09-07 16:32:56,CoinDesk,,21,44,97,"Ripple general counsel Brynly Llyr, who joined the firm in 2016 as its top legal officer, has left the firm, a spokesperson told CoinDesk. http://ow.ly/jYkD30lJf0T",,,,1038102831507668992,https://twitter.com/CoinDesk/status/1038102831507668992
2018-09-06 21:30:22,CoinDesk,,14,43,134,"The story of Ripple's chief technology officer, David Schwartz, from childhood tinkering with calculators to co-creating XRP, via @Forbes http://ow.ly/wcYl30lIkmg",,@Forbes,,1037815295488999426,https://twitter.com/CoinDesk/status/1037815295488999426
2018-09-05 16:05:17,CoinDesk,,11,197,412,"Payment provider TransferGo has announced it is launching a remittance corridor to India that uses Ripple technology for near real-time transactions. http://ow.ly/ULqd30lHbPI",,,,1037371096352391169,https://twitter.com/CoinDesk/status/1037371096352391169
2018-08-31 20:17:49,CoinDesk,,23,241,523,"JUST IN: Coil, the blockchain project from Ripple's former CTO, has begun closed beta testing. http://ow.ly/nXgB30lDReC",,,,1035622710657908736,https://twitter.com/CoinDesk/status/1035622710657908736
2018-08-30 19:23:09,CoinDesk,,6,86,167,"Ripple saw a victory Wednesday as a lawsuit against it received a ""complex"" designation, meaning it will be coordinated with another case. http://ow.ly/Rnrh30lCLz6",,,,1035246564040683521,https://twitter.com/CoinDesk/status/1035246564040683521
2018-08-16 14:00:57,CoinDesk,,31,186,421,"JUST IN: Ripple Endorses 'Preferred' Crypto Exchanges for XRP Payments http://bit.ly/2KYJRpV pic.twitter.com/qY0nJp7bSi",,,,1030092048186187776,https://twitter.com/CoinDesk/status/1030092048186187776
2018-08-16 01:30:17,CoinDesk,,13,156,354,"China is @Ripple's next big ""target"" in advancing distributed ledger technology. Partnering with Hong Kong-based LianLian International, the startup is gearing up to improve cross-border transactions between China, US and Europe, via @CNBC https://cnb.cx/2nD4u1U pic.twitter.com/Yyb11A1HG1",,@Ripple @CNBC,,1029903136675246080,https://twitter.com/CoinDesk/status/1029903136675246080
2018-08-03 06:40:05,CoinDesk,,28,69,235,"Former U.S. President @BillClinton will headline Ripple's Swell conference later this year, the #cryptocurrency payments startup.http://ow.ly/4LTE30ldHy0",,@BillClinton,#cryptocurrency,1025270058858291203,https://twitter.com/CoinDesk/status/1025270058858291203
2018-08-03 05:20:04,CoinDesk,,18,65,159,"#Cryptocurrency payments startup #Ripple is partnering with @Madonna to raise funds for orphans in the African nation of Malawi.http://ow.ly/9wl830ldHDu",,@Madonna,#Cryptocurrency #Ripple,1025249924676571136,https://twitter.com/CoinDesk/status/1025249924676571136
2018-07-31 21:05:07,CoinDesk,,53,241,570,"Ripple Partners With Madonna to Fundraise for Orphans in Malawi http://bit.ly/2vmLzvz pic.twitter.com/zJDj5zrmoO",,,,1024400588514242560,https://twitter.com/CoinDesk/status/1024400588514242560
2018-07-31 16:56:22,CoinDesk,,57,141,406,"Ripple Taps Bill Clinton to Give Keynote at Upcoming Conference http://bit.ly/2v5kQ7A pic.twitter.com/RjPNNo3kkz",,,,1024337987587461121,https://twitter.com/CoinDesk/status/1024337987587461121
2018-07-24 16:11:27,CoinDesk,,11,55,91,"Ripple Report: XRP Sales Dropped 54% in Q2, But Customer Base Grew http://bit.ly/2uM2ybc pic.twitter.com/heFjEbHR5f",,,,1021789969784950785,https://twitter.com/CoinDesk/status/1021789969784950785
2018-07-11 16:12:27,CoinDesk,,0,57,179,"Ripple Taps Facebook Payments Exec for Business Development Role http://bit.ly/2uniDDm pic.twitter.com/3IQ56aGJtt",,,,1017079180205416448,https://twitter.com/CoinDesk/status/1017079180205416448
2018-07-08 19:05:07,CoinDesk,,44,135,288,"#Ripple is facing another class-action lawsuit http://ow.ly/jVlA30kQ2vZ",,,#Ripple,1016035470483034112,https://twitter.com/CoinDesk/status/1016035470483034112
2018-07-05 15:35:11,CoinDesk,,34,56,103,"Third Ripple Lawsuit Claims XRP Is A Security http://bit.ly/2lV1wF2 pic.twitter.com/5jsqqAqODi",,,,1014895472304156672,https://twitter.com/CoinDesk/status/1014895472304156672
2018-07-03 23:30:16,CoinDesk,,48,81,204,"A look at Ripple's efforts to get companies to use XRP for its intended purpose, via @nytimes https://nyti.ms/2tRyeM0 pic.twitter.com/Fe9ragr5kP",,@nytimes,,1014290258316406786,https://twitter.com/CoinDesk/status/1014290258316406786
2018-06-21 17:03:52,CoinDesk,,23,75,185,"Ripple CEO Defends XRP Token's Utility at Fintech Conference http://bit.ly/2Mbturf pic.twitter.com/1yNNwOe9Gj",,,,1009844360408682496,https://twitter.com/CoinDesk/status/1009844360408682496
2018-06-21 14:51:17,CoinDesk,,7,42,115,". @bgarlinghouse says XRP is not a security for a few reasons: ""If Ripple shuts down, XRP will continue independently ... [and] buying XRP doesn't give you ownership of Ripple."" #FutureFintech",,@bgarlinghouse,#FutureFintech,1009810994569400320,https://twitter.com/CoinDesk/status/1009810994569400320
2018-06-21 14:50:00,CoinDesk,,2,11,34,". @bgarlinghouse: ""We are an owner of a lot of XRP, in some ways not [unlike] the early crowdsale of the ethereum tokens."" #FutureFintech",,@bgarlinghouse,#FutureFintech,1009810671196954624,https://twitter.com/CoinDesk/status/1009810671196954624
2018-06-21 14:45:54,CoinDesk,,3,12,22,"In response to a question about XRP price volatility, @bgarlinghouse notes that ""I can enable an XRP transaction in three seconds, so I have to take the volatility risk of XRP in three seconds."" Notes that a bank transfer would take much longer #FutureFintech",,@bgarlinghouse,#FutureFintech,1009809639989497856,https://twitter.com/CoinDesk/status/1009809639989497856
2018-06-21 14:42:08,CoinDesk,,6,21,50,". @bgarlinghouse: ""Let's be clear, Ripple is different than XRP."" #FutureFintech",,@bgarlinghouse,#FutureFintech,1009808693242859521,https://twitter.com/CoinDesk/status/1009808693242859521
2018-06-21 14:40:43,CoinDesk,,1,10,22,". @bgarlinghouse, CEO of @Ripple, takes the stage at #FutureFintech",,@bgarlinghouse @Ripple,#FutureFintech,1009808337154793472,https://twitter.com/CoinDesk/status/1009808337154793472
