date,username,to,replies,retweets,favorites,text,geo,mentions,hashtags,id,permalink
2018-06-15 05:19:02,CoinDesk,,27,184,485,"Ripple to Invest $2 Million in Texas University's Blockchain Research http://bit.ly/2t4qCp9 pic.twitter.com/vfL4qFXnec",,,,1007492657290072065,https://twitter.com/CoinDesk/status/1007492657290072065
2018-06-15 03:15:05,CoinDesk,,16,27,61,"Even Ripple’s own chief cryptographer, David Schwartz, is sounding lukewarm about distributed ledgers’ readiness for the big time. @Reuters https://reut.rs/2Mqva0M pic.twitter.com/OMKbGci79W",,@Reuters,,1007461462640680960,https://twitter.com/CoinDesk/status/1007461462640680960
2018-06-14 19:30:34,CoinDesk,,53,37,86,"Western Union hasn’t yet found a way to save money from its experiment with Ripple’s XRapid product, the remittance giant’s CEO, Hikmet Ersek, tells @FortuneMagazine https://for.tn/2MlEbIJ pic.twitter.com/dusBRAYDJu",,@FortuneMagazine,,1007344563613323270,https://twitter.com/CoinDesk/status/1007344563613323270
2018-06-13 17:31:47,CoinDesk,,6,35,58,"Coinbase, Ripple Blast Company Creating Equity Tokens in Their Name http://bit.ly/2Jxtkxz pic.twitter.com/WxO9cNV5JN",,,,1006952283928752133,https://twitter.com/CoinDesk/status/1006952283928752133
2018-06-06 13:03:05,CoinDesk,,29,266,677,"JUST IN: Ripple Smart Contracts Creator Targets Ethereum with New Tech Launch http://bit.ly/2M59Rld pic.twitter.com/XqhDmSn68z",,,,1004347947566403584,https://twitter.com/CoinDesk/status/1004347947566403584
2018-06-04 22:08:21,CoinDesk,,24,103,279,"Former SEC Chair Represents Ripple in XRP Lawsuit http://bit.ly/2Jc1HK2 pic.twitter.com/DuXUCGKZaM",,,,1003760395272761344,https://twitter.com/CoinDesk/status/1003760395272761344
2018-06-04 14:46:32,CoinDesk,,17,97,272,"Ripple Pumps $50 Million Into Academic Research on Blockchain http://bit.ly/2xH81nv pic.twitter.com/2Sf3atTODH",,,,1003649206140260352,https://twitter.com/CoinDesk/status/1003649206140260352
2018-05-31 16:01:15,CoinDesk,,7,87,157,"Money Transfer Firms Join Ripple's Payment Network http://bit.ly/2LOwo5J pic.twitter.com/WhzqqcpbvL",,,,1002218458757713922,https://twitter.com/CoinDesk/status/1002218458757713922
2018-05-29 17:17:40,CoinDesk,,18,99,196,"British FX Firm Currencies Direct Pilots Ripple Tech http://bit.ly/2Jev6CE pic.twitter.com/z8Uo0kVmeX",,,,1001512913037942787,https://twitter.com/CoinDesk/status/1001512913037942787
2018-05-19 15:14:58,CoinDesk,,152,111,355,"At Ripple's Snoop Dogg Party, A Search for XRP http://bit.ly/2Gzm4e3 pic.twitter.com/RXRQ404tkJ",,,,997858158176604161,https://twitter.com/CoinDesk/status/997858158176604161
2018-05-15 16:02:29,CoinDesk,,4,88,263,"Ripple Launches 'Xpring' Initiative to Invest in XRP-Focused Startups http://bit.ly/2jZlL3z pic.twitter.com/nRNOIqx8g4",,,,996420562875543552,https://twitter.com/CoinDesk/status/996420562875543552
2018-05-10 20:01:05,CoinDesk,,29,256,599,"Ripple: XRP Payment Pilots Cut Fees by 40-70 Percent http://bit.ly/2KRTGXT pic.twitter.com/SKCo80Tbbb",,,,994668669887221760,https://twitter.com/CoinDesk/status/994668669887221760
2018-05-09 13:08:23,CoinDesk,,4,64,126,"Crypto Exchange Coinone Taps Ripple for New Remittance Service http://bit.ly/2K5va4q pic.twitter.com/pUwK6AjfCk",,,,994202423873896448,https://twitter.com/CoinDesk/status/994202423873896448
2018-05-04 18:31:20,CoinDesk,,74,68,148,"Investor Sues Ripple Alleging 'XRP Is A Security' http://bit.ly/2KCEe1F pic.twitter.com/Qf8yNNldYp",,,,992471757251596290,https://twitter.com/CoinDesk/status/992471757251596290
2018-05-02 06:30:03,CoinDesk,,10,53,125,"Fortune – Is the SEC Gunning for Ethereum and Ripple? Fat Chance https://for.tn/2jmYNDc by @jeffjohnroberts",,@jeffjohnroberts,,991565464395542528,https://twitter.com/CoinDesk/status/991565464395542528
2018-05-02 02:38:25,CoinDesk,,47,61,101,"Ripple Scrutinized Over XRP at UK Parliament Blockchain Hearing http://bit.ly/2jncGBi pic.twitter.com/fIlxWY4xG0",,,,991507170503086081,https://twitter.com/CoinDesk/status/991507170503086081
2018-05-01 13:05:05,CoinDesk,,10,101,293,"Ripple's Enterprise Blockchain Network Adds a New Bank http://bit.ly/2HHkI6A pic.twitter.com/g7MNUGr1Zm",,,,991302489633943552,https://twitter.com/CoinDesk/status/991302489633943552
2018-04-27 18:01:51,CoinDesk,,9,71,134,"5 More Payments Firms to Adopt Ripple's xVia Tech http://bit.ly/2HwmxmJ pic.twitter.com/pm13NFlZoE",,,,989927622732845056,https://twitter.com/CoinDesk/status/989927622732845056
2018-04-26 19:06:26,CoinDesk,,24,131,326,"Ripple Says Sales of XRP Cryptocurrency Rose 83% In Q1 http://bit.ly/2Kgu5aV pic.twitter.com/L28ZvOqOBn",,,,989581485459034117,https://twitter.com/CoinDesk/status/989581485459034117
2018-04-24 18:28:04,CoinDesk,,110,449,1295,"Snoop Dogg to Perform at Ripple's Blockchain Week NYC Party http://bit.ly/2HW0rqJ pic.twitter.com/vv0xCjm7sk",,,,988847054028984320,https://twitter.com/CoinDesk/status/988847054028984320
2018-04-23 20:29:34,CoinDesk,,3,6,8,"Gensler says ""I thikn there's a particularly strong case for XRP"" due to its affiliation with Ripple Labs. #BizOfBlockchain",,,#BizOfBlockchain,988515243402973184,https://twitter.com/CoinDesk/status/988515243402973184
2018-04-23 20:19:50,CoinDesk,,2,7,19,"Gensler: ""Ripple Labs sure seems like a common enterprise, or the Ethereum Foundation in 2014. Ripple is doing a lot ot advance the value of XRP."" #BizOfBlockchain",,,#BizOfBlockchain,988512792675344384,https://twitter.com/CoinDesk/status/988512792675344384
2018-04-19 18:12:24,CoinDesk,,51,101,272,"Dilip Rao, Ripple's global head of infrastructure innovation: ""[XRP] is a network asset, it's not issued by anybody. If [U.S. President Donald Trump] tweets, [it affects the dollar.] Ripple can tweet all it wants, nothing's going to happen to that XRP."" #Synchronize2018",,,#Synchronize2018,987031171375693824,https://twitter.com/CoinDesk/status/987031171375693824
2018-04-16 14:42:05,CoinDesk,,30,121,284,"Why Ripple's XRP Outperformed the Other Top Cryptos This Week http://bit.ly/2JL5VoR pic.twitter.com/Hew23E2PQK",,,,985891082633400322,https://twitter.com/CoinDesk/status/985891082633400322
2018-04-11 18:42:05,CoinDesk,,19,116,220,"Ripple Invests $25 Million of XRP in Blockchain Capital Fund http://bit.ly/2qr6QBM pic.twitter.com/m0aKgBVFAL",,,,984139541266214912,https://twitter.com/CoinDesk/status/984139541266214912
2018-04-10 12:19:58,CoinDesk,ClemondNFlinch,2,2,1,"This is not a CoinDesk article",,,,983680987841245184,https://twitter.com/CoinDesk/status/983680987841245184
2018-04-08 11:34:40,CoinDesk,,43,73,145,"Is XRP a Security? That And Other Ripple Debates Explained http://bit.ly/2qellsP pic.twitter.com/Y99glROYp8",,,,982944812440735744,https://twitter.com/CoinDesk/status/982944812440735744
2018-04-05 13:07:33,CoinDesk,,21,93,175,"An XRP ICO? It's Happening Whether Ripple Likes It or Not http://bit.ly/2JnKdqu pic.twitter.com/RVhzGwD1Bb",,,,981881024664793088,https://twitter.com/CoinDesk/status/981881024664793088
2018-03-28 16:13:15,CoinDesk,,23,234,482,"Ripple Joins Hyperledger Blockchain Consortium http://bit.ly/2GEVk05 pic.twitter.com/kuXAtO7cqI",,,,979028656633843712,https://twitter.com/CoinDesk/status/979028656633843712
2018-03-28 14:01:29,CoinDesk,,15,198,443,"JUST IN: Uphold Adds Buy and Sell Options for Ripple's XRP http://bit.ly/2uxlA7o pic.twitter.com/4YKNvhsKVw",,,,978995493870166016,https://twitter.com/CoinDesk/status/978995493870166016
2018-03-20 12:05:32,CoinDesk,,103,595,1137,"Ripple's XRP Just Might Be the Next Big Crypto Futures Market http://bit.ly/2FZCTQ8 pic.twitter.com/PM7SGfywNK",,,,976067212543909889,https://twitter.com/CoinDesk/status/976067212543909889
2018-03-13 11:31:56,CoinDesk,,10,169,312,"Thai Bank Extending Ripple Remittance Options to Euro and Pound http://bit.ly/2FPuotQ pic.twitter.com/mrRHIGr6Jd",,,,973522040870256641,https://twitter.com/CoinDesk/status/973522040870256641
2018-03-08 05:14:59,CoinDesk,bgarlinghouse,6,59,106,"Ripple CEO on SEC statements https://twitter.com/bgarlinghouse/status/971552789229797376 …",,,,971615238180233216,https://twitter.com/CoinDesk/status/971615238180233216
2018-03-07 08:33:20,CoinDesk,,10,131,250,"Japanese Banks to Harness Ripple DLT for Consumer Payments App http://bit.ly/2oNI5Qy pic.twitter.com/yGu2PKFwnp",,,,971302769796796416,https://twitter.com/CoinDesk/status/971302769796796416
2018-03-05 21:32:11,CoinDesk,,30,110,173,"'No Decision' on New Assets, Coinbase Says Amid Ripple Rumors http://bit.ly/2FhjD05 pic.twitter.com/XG4h91PB6H",,,,970773995326005249,https://twitter.com/CoinDesk/status/970773995326005249
2018-03-05 13:19:09,CoinDesk,,52,320,660,"Over $1: XRP Rises As Ripple-Coinbase Rumors Renew http://bit.ly/2FgEsse pic.twitter.com/VBGDpy40WJ",,,,970649920372912129,https://twitter.com/CoinDesk/status/970649920372912129
2018-03-04 11:31:26,CoinDesk,,39,360,672,"How XRP Fits Into Ripple's Payments Products Explained http://bit.ly/2Fdl1k2 pic.twitter.com/lS6PW2ocjb",,,,970260424921894912,https://twitter.com/CoinDesk/status/970260424921894912
2018-03-01 13:01:32,CoinDesk,,31,411,774,"BREAKING: Payment Provider Fleetcor to Pilot Ripple's XRP Cryptocurrency http://bit.ly/2oFOM6c pic.twitter.com/gVd1jvdTlK",,,,969195937447989248,https://twitter.com/CoinDesk/status/969195937447989248
2018-02-27 07:43:28,CoinDesk,,19,25,58,"#ripple #XRPUSD looks set to test supply around the trendline hurdle. (4-hour chart, Bitfinex)pic.twitter.com/Yfzxby0Sw5",,,#ripple #XRPUSD,968391117766103043,https://twitter.com/CoinDesk/status/968391117766103043
2018-02-21 16:05:22,CoinDesk,,70,527,955,"BREAKING: Ripple Papers Promise New Start for $40 Billion XRP Cryptocurrency http://bit.ly/2Cb06k6 pic.twitter.com/fdlQTeddg4",,,,966343097075593217,https://twitter.com/CoinDesk/status/966343097075593217
2018-02-21 15:09:43,CoinDesk,,50,285,648,"Ripple Adds 5 New Clients Across 4 Countries http://bit.ly/2ofxtcz pic.twitter.com/DHcDHdG74u",,,,966329090864308224,https://twitter.com/CoinDesk/status/966329090864308224
2018-02-19 13:08:45,CoinDesk,,15,58,145,"Coinbase. Ripple. Uphold? Investor Greg Kidd Defends Boldest Bet http://bit.ly/2oal5La pic.twitter.com/4p2ir0lvzf",,,,965573871880560640,https://twitter.com/CoinDesk/status/965573871880560640
2018-02-14 16:21:11,CoinDesk,,25,228,451,"Saudi Central Bank to Test Ripple Payments Tech http://bit.ly/2HgkEH2 pic.twitter.com/spOuOOlcqP",,,,963810360246591488,https://twitter.com/CoinDesk/status/963810360246591488
2018-02-12 17:02:04,CoinDesk,,33,198,443,"UAE Remittance Firm Partners With DLT Startup Ripple http://bit.ly/2Enpl00 pic.twitter.com/axW82jQ6QQ",,,,963095873776488448,https://twitter.com/CoinDesk/status/963095873776488448
2018-02-12 13:26:29,CoinDesk,,77,282,652,"#Ripple (XRP) sees high volume bullish breakout https://goo.gl/22cUfd pic.twitter.com/MrhWfl6bJo",,,#Ripple,963041622480097281,https://twitter.com/CoinDesk/status/963041622480097281
2018-02-07 20:16:04,CoinDesk,,23,80,183,"Ripple CEO @bgarlinghouse : ""If there’s a 100 different things that you’re doing, you’re going to have zero [customers] because you can’t understand 100 different customers’ needs."" #yahooams",,@bgarlinghouse,#yahooams,961332757921173504,https://twitter.com/CoinDesk/status/961332757921173504
2018-02-07 20:12:43,CoinDesk,,33,158,503,"Ripple CEO @bgarlinghouse : ""I try not to check the price of XRP multiple times a day. I check once a day. Sure the price is going to go up, it’s going to go down, what I focus on is what are we doing for our customers."" #YahooAMS",,@bgarlinghouse,#YahooAMS,961331914765471744,https://twitter.com/CoinDesk/status/961331914765471744
2018-02-07 20:04:40,CoinDesk,,12,24,70,"Garlinghouse: ""It’d be a hard sales pitch to walk into a bank and say 'rip out your ACH rail and use Ripple'"" #YahooAMS",,,#YahooAMS,961329885615673344,https://twitter.com/CoinDesk/status/961329885615673344
2018-02-07 20:00:52,CoinDesk,,22,154,411,"Garlinghouse on XRP: ""I don’t call this cryptocurrency. It’s not currency."" These are digital assets, the @Ripple CEO says. #YahooAMS",,@Ripple,#YahooAMS,961328932657262593,https://twitter.com/CoinDesk/status/961328932657262593
2018-02-07 19:59:35,CoinDesk,,11,45,104,"""It's a disservice to the revolution to pretend we can live outside the regulatory environment."" says @Ripple's Garlinghouse #YahooAMS",,@Ripple,#YahooAMS,961328606868852739,https://twitter.com/CoinDesk/status/961328606868852739
2018-02-07 19:56:43,CoinDesk,,61,147,429,"""Coffee's gonna get cold"" by the time a BTC transaction clears, @Ripple's CEO Garlinghouse says #YahooAMS",,@Ripple,#YahooAMS,961327887369555968,https://twitter.com/CoinDesk/status/961327887369555968
2018-02-07 19:54:08,CoinDesk,,34,380,921,". @Ripple CEO @BradGarlinghouse: ""The price of XRP over the last 3-5 months - I don’t think of that as success. I think of success over the next 3-5 years.""",,@Ripple @BradGarlinghouse,,961327237269262336,https://twitter.com/CoinDesk/status/961327237269262336
2018-02-03 12:44:37,CoinDesk,,129,127,341,"Ripple's XRP Worst Hit By January Market Decline http://bit.ly/2DXRAlE pic.twitter.com/orwGGz2kxj",,,,959769595723862016,https://twitter.com/CoinDesk/status/959769595723862016
2018-02-02 20:31:16,CoinDesk,,35,398,756,"Santander to Roll Out Ripple-Powered App in 4 Countries http://bit.ly/2FEVqQU pic.twitter.com/otNMBDnwt2",,,,959524643337097220,https://twitter.com/CoinDesk/status/959524643337097220
2018-02-01 14:53:14,CoinDesk,,21,34,76,"Back at $1: Ripple's XRP Retreats Amid Market Sell-off http://bit.ly/2nwCM6m pic.twitter.com/OcwT2Yi4p2",,,,959077186018816000,https://twitter.com/CoinDesk/status/959077186018816000
2018-02-01 13:48:19,CoinDesk,,81,111,280,"The price of Ripple’s XRP cryptocurrency is back below $1: https://www.coindesk.com/market-center/ripple/ …pic.twitter.com/AQHngbxdP9",,,,959060848097615872,https://twitter.com/CoinDesk/status/959060848097615872
2018-01-30 08:36:01,CoinDesk,,19,128,242,"SBI Ripple Asia Forms Consortium to Bring DLT to Securities http://bit.ly/2EoszB1 pic.twitter.com/ErZ8MxIJbh",,,,958257481414684672,https://twitter.com/CoinDesk/status/958257481414684672
2018-01-29 17:33:53,CoinDesk,,20,107,184,"Ripple Vets Raising Money for Crypto Hedge Fund http://bit.ly/2EnWgCo pic.twitter.com/XsjC38yLqJ",,,,958030452970926080,https://twitter.com/CoinDesk/status/958030452970926080
2018-01-29 13:10:00,CoinDesk,,73,377,885,"In Their Own Words: Real Companies Talk Ripple XRP Pilots http://bit.ly/2EkhOiZ pic.twitter.com/LdQGpy4sf5",,,,957964041690976256,https://twitter.com/CoinDesk/status/957964041690976256
2018-01-26 03:00:12,CoinDesk,,60,132,241,"Bloomberg – Ripple Wants XRP to Be Bitcoin for Banks. If Only the Banks Wanted It https://bloom.bg/2DNXmJG by @mattleising and @EddieRob235",,@mattleising @EddieRob235,,956723419160162304,https://twitter.com/CoinDesk/status/956723419160162304
2018-01-25 12:31:27,CoinDesk,,22,223,362,"BREAKING: Former Ripple Exec Invests $57.5 Million in Digital Money Platform Uphold http://bit.ly/2ncklUl pic.twitter.com/u5RVdhPxxv",,,,956504788967051265,https://twitter.com/CoinDesk/status/956504788967051265
2018-01-24 17:08:24,CoinDesk,,21,288,556,"Two More Companies Sign On to Test Ripple's XRP in xRapid Pilots http://bit.ly/2E6Giwh pic.twitter.com/dUZbyECtIv",,,,956212097867710465,https://twitter.com/CoinDesk/status/956212097867710465
2018-01-18 15:53:31,CoinDesk,,46,186,386,"Ripple and Stellar Lead the Way as Crypto Market Shakes Off Rout http://bit.ly/2mLuWFP pic.twitter.com/h8FvjFJ8C0",,,,954018926857474048,https://twitter.com/CoinDesk/status/954018926857474048
2018-01-16 15:04:06,CoinDesk,,24,36,84,"Ripple Price Drops to 2.5-Week Low, Eyes Sideways Trading http://bit.ly/2mC5u5t pic.twitter.com/fYGnK8LZM2",,,,953281715300118528,https://twitter.com/CoinDesk/status/953281715300118528
2018-01-11 15:07:07,CoinDesk,,86,853,1684,"MoneyGram to Pilot Ripple's XRP Token for International Payments http://bit.ly/2mllpFh pic.twitter.com/g5abBneWC0",,,,951470535929712640,https://twitter.com/CoinDesk/status/951470535929712640
2018-01-10 15:26:25,CoinDesk,,33,119,262,"Down But Not Out: Ripple Bulls May Regain the Upper Hand http://bit.ly/2CNLjZc pic.twitter.com/IokS14NqpG",,,,951113002874523648,https://twitter.com/CoinDesk/status/951113002874523648
2018-01-06 20:22:27,CoinDesk,,26,132,272,"Opinion: Ripple's Frenzied Price Rise Could Herald Long-Term Growth http://bit.ly/2F3XP8t pic.twitter.com/E8WFPqZiTt",,,,949737950685908993,https://twitter.com/CoinDesk/status/949737950685908993
2018-01-05 22:50:41,CoinDesk,,68,59,169,"Ripple's XRP has fallen below $3.00, continuing earlier losses: http://bit.ly/2CYzAIa pic.twitter.com/G3xpcH7fdm",,,,949412865907286017,https://twitter.com/CoinDesk/status/949412865907286017
2018-01-05 16:13:09,CoinDesk,,101,728,1327,"Ripple Claims 3 Big Money Transfer Firms Will Use XRP in 2018 http://bit.ly/2EbOCcJ pic.twitter.com/jWumh2bw1E",,,,949312826618892290,https://twitter.com/CoinDesk/status/949312826618892290
2018-01-05 14:24:25,CoinDesk,,21,36,53,"Ripple Eyes Retreat After Record Price Highs http://bit.ly/2lWBdhb pic.twitter.com/eXzcSFthkF",,,,949285459351474176,https://twitter.com/CoinDesk/status/949285459351474176
2018-01-05 13:01:03,CoinDesk,,24,51,121,"FT – The Ripple Effect http://on.ft.com/2Ec4mwG by @izakaminska",,@izakaminska,,949264483117133824,https://twitter.com/CoinDesk/status/949264483117133824
2018-01-04 20:41:28,CoinDesk,,33,123,240,"$100 Billion Controversy: XRP's Surge Raises Hard Questions for Ripple http://bit.ly/2lTqPH4 pic.twitter.com/lHk3BTOQMD",,,,949017961230192640,https://twitter.com/CoinDesk/status/949017961230192640
2018-01-04 18:27:43,CoinDesk,,9,42,75,"Ripple Fever? Other Crypto Assets Are Outpacing Its 2018 Gains http://bit.ly/2CzKJBx pic.twitter.com/fZQDVpQqXE",,,,948984303194689536,https://twitter.com/CoinDesk/status/948984303194689536
2018-01-03 17:52:41,CoinDesk,,43,224,576,"Ripple's XRP Token Sets All-Time Price High Above $3 http://bit.ly/2E1yUkr pic.twitter.com/hLp9mJhTmF",,,,948613095991250944,https://twitter.com/CoinDesk/status/948613095991250944
2017-12-30 13:15:28,CoinDesk,,16,41,113,"The price of Ripple's XRP token is up just $0.05 on the day after a week of stellar gains: http://bit.ly/2Dzw3Pr pic.twitter.com/GNZ0JKbd3O",,,,947093781282803712,https://twitter.com/CoinDesk/status/947093781282803712
2017-12-29 21:11:53,CoinDesk,,28,123,227,"With today's XRP price rise, this Ripple-R3 lawsuit is now for over $10 billion in cryptocurrency funds: http://bit.ly/2ClQ5jE",,,,946851288448425984,https://twitter.com/CoinDesk/status/946851288448425984
2017-12-29 15:41:08,CoinDesk,,48,358,769,"Ripple Approaching $2 as XRP Price Doubles in Weekly Trading http://bit.ly/2Ec7aKM pic.twitter.com/GoUvWUWPrS",,,,946768053257359360,https://twitter.com/CoinDesk/status/946768053257359360
2017-12-22 13:53:55,CoinDesk,,6,21,46,"A day after setting a new record, Ripple’s XRP cryptocurrency is down 35% from its all-time high (Data via @onchainfx)pic.twitter.com/5qxss3Vz9d",,@onchainfx,,944204357637169152,https://twitter.com/CoinDesk/status/944204357637169152
2017-12-21 12:03:22,CoinDesk,,41,375,811,"Ripple Price Passes Historic $1 Milestone http://bit.ly/2Btkhtg pic.twitter.com/B2YUFBNgL9",,,,943814148139487233,https://twitter.com/CoinDesk/status/943814148139487233
2017-12-15 16:02:24,CoinDesk,,38,571,955,"Ethereum, Ripple And Litecoin Have Arrived on Bloomberg Terminals http://bit.ly/2BdmkOX pic.twitter.com/0Aa8w07qZN",,,,941699974185746433,https://twitter.com/CoinDesk/status/941699974185746433
2017-12-14 15:12:51,CoinDesk,,14,110,234,"Up 50%: Ripple's XRP Sets Price Record Amid Overstretched Rally http://bit.ly/2o4Wz0i pic.twitter.com/0sgQXQ2ACh",,,,941325117531049984,https://twitter.com/CoinDesk/status/941325117531049984
2017-12-08 12:21:37,CoinDesk,,13,36,88,"Crypto Market Snapshot Early Morning Session: 00:00~06:00 UTC Top 3 Performers Populous +10.29% Bitcoin Cash +10.08% Ripple +9.06%",,,,939107695742906369,https://twitter.com/CoinDesk/status/939107695742906369
2017-12-07 14:35:59,CoinDesk,,20,71,129,"Moving Up: IOTA Overtakes Ripple, Finds New Price Base http://bit.ly/2BUWizR pic.twitter.com/rebBQvCY8O",,,,938779125229277184,https://twitter.com/CoinDesk/status/938779125229277184
2017-11-28 20:52:28,CoinDesk,,12,69,156,"TechCrunch Founder Arrington Raising $100 Million Ripple Hedge Fund http://bit.ly/2k9cmtu pic.twitter.com/zQYCPzpjkA",,,,935612379769040896,https://twitter.com/CoinDesk/status/935612379769040896
2017-11-28 20:23:51,CoinDesk,,21,30,74,"Crypto ""is very volatile. Volatility does not do good things to people's minds."" @miguelvias, head of XRP markets, @Ripple pic.twitter.com/YxEQ8B6ydI",,@miguelvias @Ripple,,935605176274210817,https://twitter.com/CoinDesk/status/935605176274210817
2017-11-22 17:04:59,CoinDesk,,5,59,106,"Standard Chartered, Axis Launch Payments Service With Ripple Tech http://bit.ly/2Anii98 pic.twitter.com/PfBcj6E2se",,,,933380804436283397,https://twitter.com/CoinDesk/status/933380804436283397
2017-11-21 22:31:43,CoinDesk,,28,78,126,"BitLicense Architect Ben Lawsky Joins Ripple Board http://bit.ly/2iE9fpF pic.twitter.com/yQG2NCTvz9",,,,933100641001414656,https://twitter.com/CoinDesk/status/933100641001414656
2017-11-17 14:32:02,CoinDesk,,9,65,119,"Ripple Makes a Splash: XRP Price Looks Up on Amex News http://bit.ly/2AVbDjj pic.twitter.com/fM9ksPPCcv",,,,931530372785033217,https://twitter.com/CoinDesk/status/931530372785033217
2017-11-16 13:02:07,CoinDesk,,54,471,741,"BREAKING: American Express Opens First Blockchain Corridor With Ripple Tech http://bit.ly/2ATtszm pic.twitter.com/dhN41k6VDe",,,,931145355818946560,https://twitter.com/CoinDesk/status/931145355818946560
2017-11-03 13:33:22,CoinDesk,,4,53,67,"Ripple Price Outlook Positive on Korean Volume, Analyst Prediction http://bit.ly/2yq3Nkh pic.twitter.com/7NM72YYdEd",,,,926442178364231681,https://twitter.com/CoinDesk/status/926442178364231681
2017-11-01 13:01:10,CoinDesk,,5,33,51,"American Banker – R3 to Take on Ripple With Cross-Border Payments Blockchain http://bit.ly/2yjSNoo by @pennycrosman",,@pennycrosman,,925709297757163520,https://twitter.com/CoinDesk/status/925709297757163520
2017-10-18 17:02:29,CoinDesk,,9,16,31,"In 'Search' of a Swell? XRP Prices Rise and Fall Amid Ripple Event http://bit.ly/2x6hgck pic.twitter.com/Eg9Dtu9b1y",,,,920696596609798145,https://twitter.com/CoinDesk/status/920696596609798145
2017-10-17 11:37:32,CoinDesk,,4,21,45,"Downplaying 'Digital Assets': Blockchain Reigns at Ripple's Swell Event http://bit.ly/2kWD9co pic.twitter.com/6IUNrRSW3S",,,,920252433258958848,https://twitter.com/CoinDesk/status/920252433258958848
2017-10-16 16:02:37,CoinDesk,,21,358,543,"Gates Foundation to Use Ripple Interledger Tech in Mobile Payments Push http://bit.ly/2kUshf6 pic.twitter.com/w5vgmYypT6",,,,919956758675812354,https://twitter.com/CoinDesk/status/919956758675812354
2017-10-10 13:04:55,CoinDesk,,4,92,118,"100 and Counting: Ripple Adds New Members to Distributed Ledger Network http://bit.ly/2y9orlk pic.twitter.com/ISbhSIHxws",,,,917737711334764545,https://twitter.com/CoinDesk/status/917737711334764545
2017-10-09 14:03:07,CoinDesk,,11,52,97,"On the Rebound? Ripple's XRP Price Jumps to 7-Week High http://bit.ly/2yaVTtV pic.twitter.com/pAD4qvtUv5",,,,917389970125606915,https://twitter.com/CoinDesk/status/917389970125606915
2017-10-06 15:03:31,CoinDesk,,30,21,43,"s Ripple's Rally Over? XRP Price Runs Into Roadblock http://bit.ly/2y5CEBY pic.twitter.com/zaM6hxiYA9",,,,916318003444187137,https://twitter.com/CoinDesk/status/916318003444187137
2017-10-04 15:24:26,CoinDesk,,17,85,118,"Ripple Price Consolidates, But Could It 'Swell' Toward New Highs? http://bit.ly/2xZOZY9 pic.twitter.com/A6diXpoDim",,,,915598491740721152,https://twitter.com/CoinDesk/status/915598491740721152
2017-09-14 12:46:13,CoinDesk,,2,49,87,"EXCLUSIVE – Old Flames, New Code: Ripple and Hyperledger Reunite for Interledger Effort http://bit.ly/2y0OI3V pic.twitter.com/ZAqSttbfxd",,,,908310921214414848,https://twitter.com/CoinDesk/status/908310921214414848
2017-09-12 14:38:18,CoinDesk,,21,198,378,"SBI Ripple Asia to Test Blockchain Bank Transfers Between Japan and South Korea http://bit.ly/2gYGhmv pic.twitter.com/e8KScurAod",,,,907614352341176320,https://twitter.com/CoinDesk/status/907614352341176320
2017-09-08 20:09:48,CoinDesk,,3,37,42,"Blockchain Firms Ripple, R3 File Dueling Lawsuits Over Cryptocurrency Contract Dispute http://bit.ly/2vTE2aM pic.twitter.com/GIFDQ6kQV2",,,,906248222443794432,https://twitter.com/CoinDesk/status/906248222443794432
2017-09-06 10:45:02,CoinDesk,Ripple,4,62,144,"Ripple, expanding https://twitter.com/ripple/status/905257283684143104 …",,,,905381321391951872,https://twitter.com/CoinDesk/status/905381321391951872
2017-08-31 12:30:52,CoinDesk,,2,69,102,"Bitcoin Retirement Fund Provider Adds Ripple in IRA Product Update http://bit.ly/2vv3i6X pic.twitter.com/AwDwzNyMJ5",,,,903233627030474754,https://twitter.com/CoinDesk/status/903233627030474754
2017-08-24 19:27:25,CoinDesk,,2,33,41,"Bernanke, Berners-Lee to Headline Ripple's 'Sibos-Killer' Conference http://bit.ly/2wC4mX4 pic.twitter.com/TxZMNBAIOB",,,,900801740991344640,https://twitter.com/CoinDesk/status/900801740991344640
2017-08-22 17:33:20,CoinDesk,,11,81,104,"Ripple's XRP Price Climbs 40% on Surge in Korean Trading http://bit.ly/2wk0Sb0 pic.twitter.com/obzZ7ypxV8",,,,900048254867578880,https://twitter.com/CoinDesk/status/900048254867578880
2017-08-21 08:01:46,CoinDesk,,4,38,58,"Hints and Rumors? How Ripple Might Really Enter China http://bit.ly/2wvuFgA pic.twitter.com/L3MWXzxbKI",,,,899542026387062785,https://twitter.com/CoinDesk/status/899542026387062785
2017-08-17 13:00:33,CoinDesk,,0,37,25,"EXCLUSIVE: Lightning Bank Ledgers? Bitfury and Ripple Demo New Twist on Bitcoin Tech http://bit.ly/2vLuPxW pic.twitter.com/dq2UXXq40X",,,,898167664920735746,https://twitter.com/CoinDesk/status/898167664920735746
