date,username,to,replies,retweets,favorites,text,geo,mentions,hashtags,id,permalink
2020-04-06 13:42:10,CoinDesk,,13,28,59,". @Poloniex has launched an initial exchange offering (IEO) platform that aligns the exchange more closely with the interests of Tron founder @justinsuntron. @paddybaker_ reportshttps://www.coindesk.com/poloniexs-new-tron-powered-ieo-platform-moves-exchange-closer-to-justin-suns-orbit …",,@Poloniex @justinsuntron @paddybaker_,,1247157654864224256,https://twitter.com/CoinDesk/status/1247157654864224256
2020-04-06 10:50:11,CoinDesk,,4,26,50,"A flood of class-action lawsuits were filed in New York Friday, taking aim at token issuances from a number of major cryptocurrency projects including @Binance, Tron, Civic and @block_one_. Via @Dan_Z_Palmerhttps://www.coindesk.com/top-crypto-firms-including-binance-civic-tron-targeted-in-flood-of-lawsuits …",,@Binance @block_one_ @Dan_Z_Palmerhttps,,1247114373082091520,https://twitter.com/CoinDesk/status/1247114373082091520
2020-03-05 12:30:54,CoinDesk,,7,10,29,"OPINION: Tron's takeover of Steemit is part of a trend: the takeover of decentralized networks by companies that put their own interests ahead of their users, says @valerian253 of @_popnetwork.https://www.coindesk.com/trons-takeover-of-steemit-is-internet-history-repeating-itself …",,@valerian253 @_popnetwork,,1235543308732166149,https://twitter.com/CoinDesk/status/1235543308732166149
2020-02-24 08:02:10,CoinDesk,,98,209,648,"OPINION: People mock Justin Sun and TRON. But, by several metrics, it's a successful business. Time to get over the snobbery, says VC @alexandersblum.http://ow.ly/dYWE50ytVtT",,@alexandersblum,,1231851799814057985,https://twitter.com/CoinDesk/status/1231851799814057985
2020-02-14 16:03:25,CoinDesk,,15,79,202,"NEW: @steemit, the blockchain-based social media platform, is partnering with the @Tronfoundation, introducing Steem dapps and users to the Tron network. http://ow.ly/Q21c50ymEAs Via @nikhileshde",,@steemit @Tronfoundation @nikhileshde,,1228349032315203586,https://twitter.com/CoinDesk/status/1228349032315203586
2020-02-12 10:24:23,CoinDesk,,22,35,92,"Cryptocurrency exchange @Poloniex, recently acquired by an investment group including Tron founder Justin Sun, has been forced to roll back trading activity after it introduced an error in its system. Via @Dan_Z_Palmerhttp://ow.ly/3LkG50ykf7r",,@Poloniex @Dan_Z_Palmerhttp,,1227538934172962818,https://twitter.com/CoinDesk/status/1227538934172962818
2020-01-27 17:14:37,CoinDesk,,4,6,16,"NEW EPISODE: #CryptoRoundUp w/ @johnbiggs. A daily dive into news and trends impacting markets. Today's Topics: • Bitcoin bullish • TRON's management style revealed • Bitcoin Gold hacked?",,@johnbiggs,#CryptoRoundUp,1221843967630815239,https://twitter.com/CoinDesk/status/1221843967630815239
2019-10-29 13:41:42,CoinDesk,,45,165,550,"Tron founder @justinsuntron will appear on stage at #SDC19 Tuesday to announce that @SamsungMobile is adding the blockchain to its Keystore development kit. http://ow.ly/P3vB50wWjsj @La__Cuen reports",,@justinsuntron @SamsungMobile @La__Cuen,#SDC19,1189175477933629440,https://twitter.com/CoinDesk/status/1189175477933629440
2019-10-22 07:05:00,CoinDesk,,11,53,182,"JUST IN: The enhanced crypto functionality will let @opera for android users make bitcoin payments from its built-in digital wallet and interact with dapps on TRON. @realDannyNelson reports.http://ow.ly/Pq5P50wQUxe",,@opera @realDannyNelson,,1186538928674934784,https://twitter.com/CoinDesk/status/1186538928674934784
2019-09-19 19:36:31,CoinDesk,,15,75,238,"Ethereum scaling solution Loom Network is bringing Maker's $dai stablecoin to the tron and binance blockchains. Report via @wsfoxley @binance @Tronfoundation @MakerDAO @loomnetworkhttps://www.coindesk.com/loom-network-is-bringing-defi-to-tron-binance-chain …",,@wsfoxley @binance @Tronfoundation @MakerDAO @loomnetworkhttps,,1174769257420247040,https://twitter.com/CoinDesk/status/1174769257420247040
2019-07-26 04:58:20,CoinDesk,,161,136,520,"LATEST: @Tronfoundation CEO @justinsuntron couldn’t attend his lunch on Thursday with Warren Buffett due to kidney stones, he said. But on Thursday night in San Francisco, he made a brief appearance at a Tron influencer party. @zackseward reports.http://ow.ly/kvE150vc5Iy",,@Tronfoundation @justinsuntron @zackseward,,1154616922748661760,https://twitter.com/CoinDesk/status/1154616922748661760
2019-07-21 17:00:13,CoinDesk,,40,143,452,"Tron’s @justinsuntron Invites eToro Founder @yoniassia To Lunch With Buffett http://ow.ly/ZYN650v7cOB via @johnbiggs",,@justinsuntron @yoniassia @johnbiggs,,1152986648109559810,https://twitter.com/CoinDesk/status/1152986648109559810
2019-06-12 19:10:53,CoinDesk,,34,112,314,"$TRON founder Justin Sun will take Warren Buffett to a restaurant in Silicon Valley - a big move for the notoriously picky billionaire investor. http://ow.ly/w56o50uCDcH via @danielgkuhn",,@danielgkuhn,,1138886408700145672,https://twitter.com/CoinDesk/status/1138886408700145672
2019-05-16 14:02:24,CoinDesk,,18,147,456,"Opera is working to integrate support for Tron’s TRX and TRC-standard tokens in its browser-based crypto wallet. @opera @Tronfoundationhttp://ow.ly/EVml50ueRhc",,@opera @Tronfoundationhttp,,1129024300370026496,https://twitter.com/CoinDesk/status/1129024300370026496
2019-05-13 13:20:13,CoinDesk,,25,67,184,"JUST IN: Tron's now-former CTO has been accused of embezzlement and bribery in the wake of his exit from the popular blockchain project, allegations that he denies. http://ow.ly/yj3O30oIyTQ @WolfieZhao reports",,@WolfieZhao,,1127926522038370306,https://twitter.com/CoinDesk/status/1127926522038370306
2019-03-09 17:08:15,CoinDesk,jgarzik,0,1,5,"@jgarzik is right here; “native” isn’t the right word. It’s a token on the tron blockchain",,@jgarzik,,1104428697262661632,https://twitter.com/CoinDesk/status/1104428697262661632
2019-03-09 05:00:26,CoinDesk,,16,65,195,"Tether is gearing up to launch its controversial stablecoin as a native token on the Tron blockchain. http://ow.ly/JeFt30nXOjY",,,,1104245535261773826,https://twitter.com/CoinDesk/status/1104245535261773826
2019-03-04 17:03:13,CoinDesk,,62,156,502,"JUST IN: Tether is gearing up to launch its controversial stablecoin as a native token on the Tron blockchain. http://ow.ly/oJQW30nURwz @nikhileshde reports",,@nikhileshde,,1102615492089520128,https://twitter.com/CoinDesk/status/1102615492089520128
2019-02-10 11:01:34,CoinDesk,,42,201,424,"Starting Monday, Tron embarks on one of the longest airdrop experiments in history, with BitTorrent Token giveaways happening monthly into 2025. @Tronfoundation @justinsuntron @BitTorrent. Report by @BradyDalehttp://ow.ly/udex30nE0YS",,@Tronfoundation @justinsuntron @BitTorrent @BradyDalehttp,,1094551945216487425,https://twitter.com/CoinDesk/status/1094551945216487425
2019-01-24 22:48:44,CoinDesk,,23,56,171,"Token-funded blockchain project Tron is not only hiring while others cut staff, it's recruiting an entourage for its founder, reports @baidakovahttp://ow.ly/dJID50kjVsD",,@baidakovahttp,,1088569318521081857,https://twitter.com/CoinDesk/status/1088569318521081857
2019-01-21 10:01:48,CoinDesk,,15,157,514,"At Tron's niTROn Summit, CEO @justinsuntron sketched out his vision for how @BitTorrent's massive user base can leapfrog the crypto adoption problem.http://ow.ly/mrDi30no5f8",,@justinsuntron @BitTorrent,,1087289148900286465,https://twitter.com/CoinDesk/status/1087289148900286465
2019-01-10 02:13:30,CoinDesk,,0,2,2,"“Tron doesn’t really have any technology at all.” - @pierre_rochard right now on #CoindeskLIVE",,@pierre_rochard,#CoindeskLIVE,1083185029818318848,https://twitter.com/CoinDesk/status/1083185029818318848
2019-01-08 17:06:50,CoinDesk,,44,323,803,"BitTorrent has the user base, Tron has the crypto. The new BitTorrent Token (BTT) white paper explores ways to marry the two. http://ow.ly/9PMD30neHa6",,,,1082685068605358087,https://twitter.com/CoinDesk/status/1082685068605358087
2018-09-28 16:41:26,CoinDesk,,34,342,866,"BitTorrent users will soon be able to receive Tron's tokens as rewards for maintaining files online for extended periods of time. http://ow.ly/f6hR30m17MJ",,,,1045715113158868992,https://twitter.com/CoinDesk/status/1045715113158868992
2018-09-10 04:04:15,CoinDesk,,8,86,160,"Tron and Neo weren't the only crypto projects interested in acquiring BitTorrent; in fact, CoinDesk has learned, five others were tempted to buy too. http://ow.ly/a2OC30lKqBT",,,,1039001583206506496,https://twitter.com/CoinDesk/status/1039001583206506496
2018-09-08 16:15:15,CoinDesk,,4,22,51,"FEATURE by Annaliese Milano and @BradyDale: When #Tron founder @justinsuntron bought #BitTorrent, it turns out he wasn't even the highest bidder.http://ow.ly/pJxh30lIm0c",,@BradyDale @justinsuntron,#Tron #BitTorrent,1038460770353332224,https://twitter.com/CoinDesk/status/1038460770353332224
2018-09-04 22:00:12,CoinDesk,,5,49,109,"$170 MILLION: Turns out, Tron wasn't the only bidder for one of the year's biggest #crypto acquisitions. It wasn't the highest bidder either: http://ow.ly/BACj30lGxBC",,,#crypto,1037098026450526209,https://twitter.com/CoinDesk/status/1037098026450526209
2018-08-29 08:03:55,CoinDesk,,10,76,186,"JUST IN: Tron Now Owns a Stake In BitTorrent Founder's New Crypto Project http://ow.ly/pSjc30lB5x8",,,,1034713240117424129,https://twitter.com/CoinDesk/status/1034713240117424129
2018-08-21 03:43:42,CoinDesk,,41,58,172,"JUST IN – Tron's BitTorrent Acquisition Triggers String of Employee Exits https://www.coindesk.com/trons-bittorrent-crypto-acquisition-departures/ …pic.twitter.com/3pmXSEcMYZ",,,,1031748653738848261,https://twitter.com/CoinDesk/status/1031748653738848261
2018-07-26 05:45:06,CoinDesk,,8,152,471,"""We believe that joining the TRON network will further enhance #BitTorrent and accelerate our mission of creating an Internet of options, not rules.""http://ow.ly/HoAv30l7xWB",,,#BitTorrent,1022357119222333440,https://twitter.com/CoinDesk/status/1022357119222333440
2018-07-25 15:01:57,CoinDesk,,28,182,573,"Tron Foundation Officially Completes Acquisition of BitTorrent http://bit.ly/2LCuw2N pic.twitter.com/Ez9C1mrReH",,,,1022134867163799552,https://twitter.com/CoinDesk/status/1022134867163799552
2018-07-19 19:50:30,CoinDesk,,12,52,142,"It Took Just A Day for Tron's Founder to Win His Own Blockchain's Election http://bit.ly/2NZL8Ql pic.twitter.com/zbsVdYKoac",,,,1020033158241312768,https://twitter.com/CoinDesk/status/1020033158241312768
2018-06-29 19:20:50,CoinDesk,,12,42,64,"Tron's Election Is Underway, But Who's In Control of the $2 Billion Code? http://bit.ly/2N9Wyk9 pic.twitter.com/fkBLuDJPNc",,,,1012777935022034944,https://twitter.com/CoinDesk/status/1012777935022034944
2018-06-27 16:01:33,CoinDesk,,56,216,677,"Pornhub Taps Tron, ZenCash for Crypto Payment Option http://bit.ly/2tATzZT pic.twitter.com/PP8tv9lJiP",,,,1012003008476008454,https://twitter.com/CoinDesk/status/1012003008476008454
2018-06-25 04:07:15,CoinDesk,,1,47,106,"Tron Independence Day Explained: What's at Stake for a $3 Billion Crypto http://bit.ly/2MnWMCT pic.twitter.com/UlhPlNB0fa",,,,1011098472383172608,https://twitter.com/CoinDesk/status/1011098472383172608
2018-06-21 19:36:53,CoinDesk,,15,170,469,"$3 Billion Blockchain Tron Kicks Off Token Migration Today http://bit.ly/2MNEjB5 pic.twitter.com/TZEZPpHHBr",,,,1009882869240598534,https://twitter.com/CoinDesk/status/1009882869240598534
2018-06-19 21:52:37,CoinDesk,,8,34,100,"Tron Bought BitTorrent And Crypto Won't Stop Talking About It http://bit.ly/2tbs0WK pic.twitter.com/dRqY1sRMpW",,,,1009192250394447872,https://twitter.com/CoinDesk/status/1009192250394447872
2018-06-19 20:33:29,CoinDesk,,7,47,90,"BitTorrent Has 'No Plans to Change' After $120 Million Tron Acquisition http://bit.ly/2t9VR23 pic.twitter.com/lrAF9tXeZl",,,,1009172338716364804,https://twitter.com/CoinDesk/status/1009172338716364804
2018-06-19 16:03:36,CoinDesk,,9,66,166,"Tron Price Spikes Big After Blockchain Founder Acquires BitTorrent http://bit.ly/2tlAgTh pic.twitter.com/1KRk2QYtn1",,,,1009104418237812736,https://twitter.com/CoinDesk/status/1009104418237812736
