date,username,to,replies,retweets,favorites,text,geo,mentions,hashtags,id,permalink
2020-03-24 00:04:12,CoinDesk,,3,11,22,". @TheGivingBlock’s charity drive will give donations to nonprofit partners including @SavetheChildren @nokidhungry @Us4Warriors. #cryptoCOVID19 is taking donations in bitcoin, litecoin, zcash and other tokens. #CoronaEfforts @AlexWilsonTGBhttps://www.thegivingblock.com/post/cryptocovid19-cryptocurrency-community-unites-to-squash-the-coronavirus …",,@TheGivingBlock @SavetheChildren @nokidhungry @Us4Warriors @AlexWilsonTGBhttps,#cryptoCOVID19 #CoronaEfforts,1242240762496106496,https://twitter.com/CoinDesk/status/1242240762496106496
2020-01-08 14:00:47,CoinDesk,,5,23,77,"JUST IN: BlockFi users can now earn interest on, trade and receive loans backed by USD Coin and litecoin. Report via @Nate_DiCamillo http://ow.ly/lVXR50xQ6BD @TheRealBlockFi",,@Nate_DiCamillo @TheRealBlockFi,,1214909817535520769,https://twitter.com/CoinDesk/status/1214909817535520769
2019-12-04 17:11:07,CoinDesk,,0,5,15,"NEW EPISODE: #MarketsDaily w/ @GamerAndy + @liqquidity. A daily dive into news and trends impacting todays markets. Today’s Topics: 1. Is Bitcoin getting boring? 2. Market Manipulation Post-Mortem w/ @galenmoore 3. Litecoin's falling hashrate http://ow.ly/opSG50xrQNa",,@GamerAndy @liqquidity @galenmoore,#MarketsDaily,1202274142147489792,https://twitter.com/CoinDesk/status/1202274142147489792
2019-12-04 16:48:28,CoinDesk,,5,28,40,"Litecoin’s price plunge in recent months has whittled away the profitability of mining the cryptocurrency, leading to a shakeout among operators. $LTC Report by @godbole17 and @Liqquidityhttp://ow.ly/POIA50xrP1s",,@godbole17 @Liqquidityhttp,,1202268442151325698,https://twitter.com/CoinDesk/status/1202268442151325698
2019-10-09 22:25:45,CoinDesk,,16,3,17,"Who was more influential in 2019: Facebook’s @davidmarcus or Litecoin’s @SatoshiLite? Vote for the heroes and villains of blockchain here: https://surveymonkey.com/r/CWLFF9F #cryptoinfluencerspic.twitter.com/pFSipde5lC",,@davidmarcus @SatoshiLite,#cryptoinfluencerspic,1182059602189393920,https://twitter.com/CoinDesk/status/1182059602189393920
2019-09-25 16:22:24,CoinDesk,,6,28,77,"The millennial-focused SoFi will offer trading in bitcoin, ethereum and litecoin next Tuesday and source its liquidity from Coinbase. Report by @DanielGKuhn http://ow.ly/kTFJ50wqQnG @SoFi @coinbase",,@DanielGKuhn @SoFi @coinbase,,1176894730971561984,https://twitter.com/CoinDesk/status/1176894730971561984
2019-09-18 17:14:13,CoinDesk,,8,44,108,"The Celsius Network will manage an undisclosed amount of the Litecoin Foundation's treasury through a mutual partnership. Report via @wsfoxley @LTCFoundation @CelsiusNetworkhttps://www.coindesk.com/litecoin-foundation-to-hold-undisclosed-treasury-sum-with-crypto-lender …",,@wsfoxley @LTCFoundation @CelsiusNetworkhttps,,1174371058335404032,https://twitter.com/CoinDesk/status/1174371058335404032
2019-08-28 07:34:10,CoinDesk,,31,112,377,"Litecoin creator Charlie Lee @SatoshiLite said he remains committed to funding the @LTCFoundation regardless of its financial standing, via @wsfoxleyhttp://ow.ly/cWy250vLZZf",,@SatoshiLite @LTCFoundation @wsfoxleyhttp,,1166614937978003458,https://twitter.com/CoinDesk/status/1166614937978003458
2019-08-23 10:32:11,CoinDesk,,2,17,45,"Mining power on the litecoin network has dropped by 28 percent since its recent ""halving"" event as miners struggle for profit. Report by @WolfieZhao http://ow.ly/EnUN50vGDHz $LTC",,@WolfieZhao,,1164847797557846016,https://twitter.com/CoinDesk/status/1164847797557846016
2019-08-21 17:54:09,CoinDesk,,30,128,232,"BREAKING: @USTreasury's OFAC has put bitcoin and litecoin addresses of three Chinese nationals on its sanctions list, the second time the agency has blacklisted crypto wallets. http://ow.ly/TDiu50vELdu Report by @nikhileshde",,@USTreasury @nikhileshde,,1164234248297046016,https://twitter.com/CoinDesk/status/1164234248297046016
2019-08-05 10:21:29,CoinDesk,,41,410,1148,"JUST IN: Litecoin, the fifth-largest cryptocurrency by market value, has just halved the block reward for miners. Report by @WolfieZhao http://ow.ly/lIAu50vnHx2 $LTC @SatoshiLite",,@WolfieZhao @SatoshiLite,,1158322124639129600,https://twitter.com/CoinDesk/status/1158322124639129600
2019-06-14 22:35:05,CoinDesk,,27,147,320,"New payment card from Crypterium offers zero fees for bitcoin, ethereum, and litecoin transactions. http://ow.ly/hBpC50uEtsO via @danielgkuhn",,@danielgkuhn,,1139662569730433024,https://twitter.com/CoinDesk/status/1139662569730433024
2019-06-10 18:07:14,CoinDesk,,19,105,305,"The price of litecoin surged another 10 percent today, pushing its price above $125 to record its highest value since May 23, 2018. http://ow.ly/YMnq50uAIYf reports @godbole17",,@godbole17,,1138145611532963840,https://twitter.com/CoinDesk/status/1138145611532963840
2019-05-13 12:45:01,CoinDesk,,20,333,807,"Germany’s second-largest stock exchange, Boerse Stuttgart, now offers trading in XRP and litecoin-based ETNs issued by XBT Provider. http://ow.ly/Qlr150u9sjN",,,,1127917663420915712,https://twitter.com/CoinDesk/status/1127917663420915712
2019-05-07 10:02:06,CoinDesk,,6,34,92,"JUST IN: Crypto mining and exchange startup @bcausellc is weeks away from launching a spot trading market for bitcoin, ether, bitcoin cash and litecoin. Report by @baidakovahttp://ow.ly/sibu50u1CJO",,@bcausellc @baidakovahttp,,1125702337769635840,https://twitter.com/CoinDesk/status/1125702337769635840
2019-04-24 11:03:32,CoinDesk,,5,24,50,"Bitcoin could be in for a price pullback, as litecoin, which led the crypto markets higher earlier in the year, is now showing signs of weakness. Report by @godbole17http://ow.ly/PRgx50rqsxw",,@godbole17http,,1121006753741770752,https://twitter.com/CoinDesk/status/1121006753741770752
2019-04-08 13:01:50,CoinDesk,,21,158,502,"JUST IN: Pantera-backed @sparkswap has launched to offer pro traders litecoin-to-bitcoin atomic swaps using the lightning network. Article by @La__Cuenhttp://ow.ly/BljI50pwkrU",,@sparkswap @La__Cuenhttp,,1115238322413154304,https://twitter.com/CoinDesk/status/1115238322413154304
2019-04-04 06:57:56,CoinDesk,,15,237,569,"JUST IN: Exchange-traded products (ETPs) tied to XRP and litecoin have gone live on Nordic Growth Market @ngmexchange, a unit of Börse Stuttgart @boersestuttgart.http://ow.ly/ApHr30ojTim",,@ngmexchange @boersestuttgart,,1113697190608871424,https://twitter.com/CoinDesk/status/1113697190608871424
2019-04-01 09:01:35,CoinDesk,,14,81,239,"JUST IN: @krakenfx's Crypto Facilities has seen trading volumes in litecoin and bitcoin cash futures surge five-fold in recent weeks. http://ow.ly/emZx30ogPOI",,@krakenfx,,1112641143660048384,https://twitter.com/CoinDesk/status/1112641143660048384
2019-03-31 13:05:09,CoinDesk,,57,378,1212,"Litecoin's price doubled in the first three months of 2019 to register its best first-quarter performance on record. http://ow.ly/BNa930ognnd",,,,1112340052867194880,https://twitter.com/CoinDesk/status/1112340052867194880
2019-03-15 21:16:24,CoinDesk,,2,5,9,"LIVE on #CryptoController: Our @twitch follower asks @samadamsSAO and @JayCoDon, ""Is Litecoin About to Go Ballistic?"" https://clips.twitch.tv/SavoryAbstemiousClamFailFish?tt_medium=twtr …",,@twitch @samadamsSAO @JayCoDon,#CryptoController,1106665475252150272,https://twitter.com/CoinDesk/status/1106665475252150272
2019-02-12 20:48:41,CoinDesk,,6,101,184,"Litecoin's block reward halving is estimated to occur in August – and an analysis of market data suggests that traders are already pricing in the event. http://ow.ly/j1Au30nG4GI",,,,1095424473430478849,https://twitter.com/CoinDesk/status/1095424473430478849
2019-01-30 17:07:06,CoinDesk,,1,1,1,"7/19 Diversifying with litecoin? In 2014, @geoburke put down a $12,000 deposit in #bitcoin for the first ASIC miner for #litecoin. A miner (that as some of you know) never appeared. http://ow.ly/gkDD30nvXpn #BitcoinRegret",,@geoburke,#bitcoin #litecoin #BitcoinRegret,1090657668128231424,https://twitter.com/CoinDesk/status/1090657668128231424
2018-12-29 16:55:07,CoinDesk,,21,182,492,"The Litecoin Foundation has partnered with the @ufc in a deal to promote the cryptocurrency.http://ow.ly/Hm8P30n7TLJ",,@ufc,,1079058243534667776,https://twitter.com/CoinDesk/status/1079058243534667776
2018-12-27 12:02:18,CoinDesk,,71,400,1416,"The litecoin logo is to take prime place in the Octagon at an Ultimate Fighting Championship event this Saturday. http://ow.ly/aUjb30n71ZK",,,,1078259776096735232,https://twitter.com/CoinDesk/status/1078259776096735232
2018-12-18 14:15:34,CoinDesk,,17,7,12,"Our @BradyDale asked @AriannaSimpson @LexSokolin @LucasNuzzi about their #Litecoin predictions at #ConsensusInvest. Watch more here: http://ow.ly/kSo530n1q7q pic.twitter.com/Yoc2nUjkEa",,@BradyDale @AriannaSimpson @LexSokolin @LucasNuzzi,#Litecoin #ConsensusInvest,1075031823846121473,https://twitter.com/CoinDesk/status/1075031823846121473
2018-11-12 10:15:12,CoinDesk,,7,58,118,"A bitcoin trader has been jailed and fined over $1.1 million for stealing bitcoin and litecoin, and then defrauding investors to repay the loss. http://ow.ly/uDxm30mAa7f",,,,1061925369589182464,https://twitter.com/CoinDesk/status/1061925369589182464
2018-10-30 14:02:53,CoinDesk,,9,26,56,"Ether, litecoin, dash and neo post year-over-year declines in 2018 first: http://ow.ly/qPbg30mqE8d",,,,1057271627510095872,https://twitter.com/CoinDesk/status/1057271627510095872
2018-10-12 13:28:10,CoinDesk,,56,531,1336,"JUST IN: Winklevoss-founded crypto exchange Gemini is adding litecoin trading in the coming week, with permission from the NYDFS. http://ow.ly/dRPt30mcRPc",,,,1050739907533172742,https://twitter.com/CoinDesk/status/1050739907533172742
2018-10-08 22:00:24,CoinDesk,,6,12,29,". @SatoshiLite told @NTmoney litecoin could “help bitcoin” by providing a testing ground for privacy and fungiblity solutions. #SFBlockchainWeekpic.twitter.com/8xyLrbMI3M",,@SatoshiLite @NTmoney,#SFBlockchainWeekpic,1049419266007564288,https://twitter.com/CoinDesk/status/1049419266007564288
2018-10-06 01:16:29,CoinDesk,,4,21,39,"""Even the small things like dust can become huge problems."" Talking dust at #scalingnbitcoin - about 50% of UTXOs are dust in #bitcoin; in #litecoin, nearly 80% of UTXOs are dust.",,,#scalingnbitcoin #bitcoin #litecoin,1048381445876543488,https://twitter.com/CoinDesk/status/1048381445876543488
2018-09-12 14:43:25,CoinDesk,,24,62,94,"The price of litecoin has nosedived to 12-month lows amid broad risk aversion in the crypto markets. http://ow.ly/1vTz30lN50E",,,,1039887210487668736,https://twitter.com/CoinDesk/status/1039887210487668736
2018-09-04 15:38:12,CoinDesk,,28,205,646,"Litecoin's price hit a one-month high Monday as the wider cryptocurrency market is seeing green. http://ow.ly/X7aJ30lGby7",,,,1037001893212577793,https://twitter.com/CoinDesk/status/1037001893212577793
2018-08-24 01:30:15,CoinDesk,,23,77,214,"Hawaii Representative Tulsi Gabbard invested between $1,001 and $15,000 in ether and litecoin in December 2017, House Judiciary Committee Chairman Bob Goodlatte bought between $17,000 to $80,000 in bitcoin, bitcoin cash and ether. Via @cryptohttp://ow.ly/MtAb30lwHTO",,@cryptohttp,,1032802233992339457,https://twitter.com/CoinDesk/status/1032802233992339457
2018-08-22 17:50:36,CoinDesk,,44,237,678,"US Congresswoman Reveals She Bought Ether and Litecoin Last Year http://ow.ly/G7JR30lvUMn",,,,1032324169776738307,https://twitter.com/CoinDesk/status/1032324169776738307
2018-08-08 03:16:52,CoinDesk,,16,61,129,"XRP, Litecoin Fall to Lowest Prices Yet Seen in 2018 http://bit.ly/2ngV8bQ pic.twitter.com/elEKGxlaVM",,,,1027030859713589248,https://twitter.com/CoinDesk/status/1027030859713589248
2018-08-03 04:15:04,CoinDesk,,8,58,146,"HTC's new #blockchain-compatible smartphone will support #litecoin. http://ow.ly/wH5230ldI4x",,,#blockchain #litecoin,1025233566182064128,https://twitter.com/CoinDesk/status/1025233566182064128
2018-07-30 17:22:41,CoinDesk,,25,368,978,"HTC Says Its Crypto-Friendly Smartphone Will Support Litecoin http://bit.ly/2LzTwZb pic.twitter.com/CABvrzL8KO",,,,1023982224310525954,https://twitter.com/CoinDesk/status/1023982224310525954
2018-07-17 20:04:36,CoinDesk,,6,84,197,"Litecoin's Lee: Bank Deal Might Lead to New Crypto Services http://bit.ly/2NqQ7Zt pic.twitter.com/FZMZsLQ8aT",,,,1019311928714375170,https://twitter.com/CoinDesk/status/1019311928714375170
2018-07-15 11:32:39,CoinDesk,,23,83,193,"What Crypto Really Thinks About Litecoin's Banking Ambitions http://bit.ly/2uIckun pic.twitter.com/6MUuTPmuEM",,,,1018458318791208961,https://twitter.com/CoinDesk/status/1018458318791208961
2018-07-14 15:55:10,CoinDesk,,17,149,307,"#Litecoin Foundation has acquired a near 10% stake in a German bank. http://ow.ly/Wp7p30kWCef",,,#Litecoin,1018161992866189312,https://twitter.com/CoinDesk/status/1018161992866189312
2018-07-13 04:05:08,CoinDesk,,50,149,386,"Why Litecoin's Creator Is Buying Into A Bank (And How It Could Go Wrong) http://bit.ly/2mgbCAA pic.twitter.com/WYMIjBhU9L",,,,1017620918204542976,https://twitter.com/CoinDesk/status/1017620918204542976
2018-07-12 13:01:57,CoinDesk,,14,149,291,"JUST IN: Litecoin, Bitcoin Cash Are Latest Crypto Additions to Robinhood Investing App - CoinDesk http://bit.ly/2NKqljJ pic.twitter.com/buotbSfscQ",,,,1017393627562201090,https://twitter.com/CoinDesk/status/1017393627562201090
2018-07-11 15:01:55,CoinDesk,,22,124,338,"Litecoin Price Spikes Above $80 on Bank Acquisition News http://bit.ly/2NHYmBd pic.twitter.com/9Daolqqpye",,,,1017061428082216960,https://twitter.com/CoinDesk/status/1017061428082216960
2018-07-11 09:02:54,CoinDesk,,50,567,1486,"Litecoin Foundation Acquires 9.9% of Bank in Payments Partnership http://bit.ly/2zsyrud pic.twitter.com/aIDKaUAyKr",,,,1016971079447957504,https://twitter.com/CoinDesk/status/1016971079447957504
2018-07-02 15:27:24,CoinDesk,,8,43,80,"For Litecoin's Price, This Week's Close Could Be Pivotal http://bit.ly/2MBCJ40 pic.twitter.com/TUKyX9JTiH",,,,1013806349891854336,https://twitter.com/CoinDesk/status/1013806349891854336
2018-06-22 15:51:18,CoinDesk,,21,64,136,"Litecoin Sinks to Lowest Price in 7 Months http://bit.ly/2Kcoy4P pic.twitter.com/3TKI7RqKOl",,,,1010188489479086080,https://twitter.com/CoinDesk/status/1010188489479086080
2018-06-20 10:01:52,CoinDesk,,82,625,1521,"JUST IN: A British Crypto Exchange Is Launching Litecoin Futures Trading http://bit.ly/2MEN28o pic.twitter.com/HtcSd8ArVr",,,,1009375773415870465,https://twitter.com/CoinDesk/status/1009375773415870465
2018-06-13 15:29:26,CoinDesk,,7,41,95,"Relief Rally Ahead? Litecoin Looks Oversold Below $100 http://bit.ly/2JzvJI0 pic.twitter.com/18qQmkLdHw",,,,1006921493815746560,https://twitter.com/CoinDesk/status/1006921493815746560
2018-05-15 15:47:08,CoinDesk,,9,37,75,"We're live: #CoinDeskLIVE with @SatoshiLite of LiteCoin at #Consensus2018https://www.pscp.tv/w/bcr4fDF4ZUVXeWJNeHJwS1B8MW5BSkVSTFpEV2V4TJtsWuTxR8bYh4AHnjfb7U7QhpoMq0g7V9lYbM70tuVu …",,@SatoshiLite,#CoinDeskLIVE #Consensus2018https,996416698801569792,https://twitter.com/CoinDesk/status/996416698801569792
2018-03-26 22:02:41,CoinDesk,,11,37,72,"Litecoin Payments Startup That Won Trader Favor Abruptly Shuts Down http://bit.ly/2ulgACV pic.twitter.com/KupNE2siu3",,,,978391815543017472,https://twitter.com/CoinDesk/status/978391815543017472
2018-03-21 13:32:20,CoinDesk,,45,319,891,"Looking Up? Litecoin Eyes Bullish Breakout at $175 http://bit.ly/2Gdf3DJ pic.twitter.com/HfP8CcTyr6",,,,976451444248326149,https://twitter.com/CoinDesk/status/976451444248326149
2018-03-14 14:22:52,CoinDesk,,4,43,73,"Lempres: ""Part of why we trade only [bitcoin, ethereum, litecoin and bitcoin cash] is because regulators have determined they are virtual currencies, and therefore, not securities."" #ICOsInTheHouse",,,#ICOsInTheHouse,973927446558007297,https://twitter.com/CoinDesk/status/973927446558007297
2018-03-07 13:15:13,CoinDesk,,15,54,95,"Litecoin Hits 12-Day Low in Fall Below $200 http://bit.ly/2FksaDC pic.twitter.com/rvX8VhzhEp",,,,971373706206380032,https://twitter.com/CoinDesk/status/971373706206380032
2018-03-01 13:46:30,CoinDesk,,11,65,80,"Litecoin Booms in February But 'Golden' Crypto Takes Price Podium http://bit.ly/2HU4OSP pic.twitter.com/pNZkj1rwxD",,,,969207252241575936,https://twitter.com/CoinDesk/status/969207252241575936
2018-02-26 13:31:11,CoinDesk,,11,45,75,"Litecoin Price Outperforms But Nears Key Resistance http://bit.ly/2EWnEqp pic.twitter.com/UNOVy0LCVK",,,,968116232942772225,https://twitter.com/CoinDesk/status/968116232942772225
2018-02-22 14:33:12,CoinDesk,,40,78,125,"Litecoin Cash Has Forked But It's Hardly Trading http://bit.ly/2Fm5lfv pic.twitter.com/xnJ4Tiag6x",,,,966682291211849728,https://twitter.com/CoinDesk/status/966682291211849728
2018-02-16 12:38:33,CoinDesk,Pedro_Es_LTC,1,2,3,"Hi Pedro. We reported on litecoin yesterday: https://www.coindesk.com/surging-litecoin-is-leading-the-crypto-market-recovery/ …",,,,964479110918623233,https://twitter.com/CoinDesk/status/964479110918623233
2018-02-16 01:48:24,CoinDesk,,43,82,141,"No, 'Litecoin Cash' Isn't Bitcoin Cash All Over Again http://bit.ly/2o7F2Bm pic.twitter.com/newnod8DGJ",,,,964315493355180033,https://twitter.com/CoinDesk/status/964315493355180033
2018-02-15 13:16:27,CoinDesk,,24,163,380,"Surging Litecoin Is Leading the Crypto Market Recovery http://bit.ly/2Et19cp pic.twitter.com/8Jjy0u4MGR",,,,964126258840862720,https://twitter.com/CoinDesk/status/964126258840862720
2018-02-14 14:20:50,CoinDesk,,70,81,159,"Fork Confusion Propels Litecoin to 1-Month High Above $200 http://bit.ly/2Heqfxn pic.twitter.com/rONr2fIBr5",,,,963780073739509760,https://twitter.com/CoinDesk/status/963780073739509760
2018-01-04 03:34:03,CoinDesk,,6,7,40,"3/ In this 2k-word #longread, the creator of litecoin talks his passion for bitcoin and his lesson from this summer’s scaling debate",,,#longread,948759401506267136,https://twitter.com/CoinDesk/status/948759401506267136
2018-01-01 15:36:23,CoinDesk,,128,243,797,"Video: Bitcoin or Litecoin? Charlie Lee on Which Crypto Had a Better 2017 http://bit.ly/2lxljKL pic.twitter.com/gHadsUcMzc",,,,947854020621762560,https://twitter.com/CoinDesk/status/947854020621762560
2017-12-22 13:58:28,CoinDesk,,18,32,61,"The price of litecoin is down nearly 40% from its all-time high on Tuesday (Data via @CoinMarketCap)pic.twitter.com/r2YnO5VLhh",,@CoinMarketCap,,944205500471705603,https://twitter.com/CoinDesk/status/944205500471705603
2017-12-20 13:36:08,CoinDesk,,60,141,315,"Litecoin Creator Sells Off Holdings Citing 'Conflict of Interest' http://bit.ly/2oZon6y pic.twitter.com/xk9b2u8CDb",,,,943475102758338560,https://twitter.com/CoinDesk/status/943475102758338560
2017-12-18 14:49:22,CoinDesk,,17,78,176,"Litecoin Faces Key Hurdle in Push Back to Record Highs http://bit.ly/2oCplpu pic.twitter.com/F6hyCJEopV",,,,942768757742735360,https://twitter.com/CoinDesk/status/942768757742735360
2017-12-15 16:02:24,CoinDesk,,38,571,955,"Ethereum, Ripple And Litecoin Have Arrived on Bloomberg Terminals http://bit.ly/2BdmkOX pic.twitter.com/0Aa8w07qZN",,,,941699974185746433,https://twitter.com/CoinDesk/status/941699974185746433
2017-12-12 17:42:16,CoinDesk,,17,67,84,"Coinbase Halts Litecoin, Ether Trades as Prices Spike http://bit.ly/2B8EYcC pic.twitter.com/CEylcZNgwH",,,,940637943756095494,https://twitter.com/CoinDesk/status/940637943756095494
2017-12-12 17:05:35,CoinDesk,,98,326,462,"BREAKING: Coinbase has “temporarily” suspended litecoin and ether buying and selling pic.twitter.com/poqgD1Ziui",,,,940628710478237696,https://twitter.com/CoinDesk/status/940628710478237696
2017-12-12 13:04:28,CoinDesk,,39,101,232,"Over $300? Pullback Likely for Surging Litecoin http://bit.ly/2l7rF6A pic.twitter.com/AtS1lCvoHN",,,,940568031603970050,https://twitter.com/CoinDesk/status/940568031603970050
2017-12-08 18:07:14,CoinDesk,,7,35,120,"Crypto Market Snapshot Afternoon Session: 12:01~18:00 UTC Top 3 Performers NEM +37.96% Populous + 32.38% Litecoin +22.62%",,,,939194673649905664,https://twitter.com/CoinDesk/status/939194673649905664
2017-12-06 14:48:39,CoinDesk,,5,62,116,"Mobile Banking App Revolut Adds Litecoin, Ether Trading http://bit.ly/2Ag1AIU pic.twitter.com/Kjbe2Z2Lvo",,,,938419923835146240,https://twitter.com/CoinDesk/status/938419923835146240
2017-11-08 17:21:15,CoinDesk,,9,24,43,"According to @jgarzik ""btc1 project will continue the stated mission -- a ""Fedora for Bitcoin' -- continuing as an alternate implementation, that supports Bitcoin, as well as other chains such as Bitcoin Cash, Litecoin and other Bitcoin-family chains.""",,@jgarzik,,928311468637999104,https://twitter.com/CoinDesk/status/928311468637999104
2017-11-08 15:16:59,CoinDesk,,8,92,213,"Litecoin Price Looks Northwards Amid Korean Volume Spike http://bit.ly/2zFIDyK pic.twitter.com/HFYFAmocQK",,,,928280195106267137,https://twitter.com/CoinDesk/status/928280195106267137
2017-10-26 16:36:02,CoinDesk,,0,9,15,"Low Volume Lift? Litecoin Prices Rise But Big Leaps Unlikely http://bit.ly/2y6VJor pic.twitter.com/UEewvnpBRw",,,,923589046529679365,https://twitter.com/CoinDesk/status/923589046529679365
2017-10-12 16:05:20,CoinDesk,,9,98,186,"Bitcoin, Ether, Litecoin: Coinbase Enables 'Instant' Purchases for US Buyers http://bit.ly/2xBfwHk pic.twitter.com/tidbLKikvp",,,,918507891291717633,https://twitter.com/CoinDesk/status/918507891291717633
2017-10-11 16:04:06,CoinDesk,,1,22,34,"Nearing Bottom? Litecoin Prices Consolidating After Rough September http://bit.ly/2gvgzDc pic.twitter.com/1KMJFDUnVk",,,,918145190916960257,https://twitter.com/CoinDesk/status/918145190916960257
2017-09-22 14:06:20,CoinDesk,,18,38,48,"Gravity's Pull? Litecoin Is Down 50% from All-Time Highs and Looking Lower http://bit.ly/2waBRf3 pic.twitter.com/eQMcv2STvM",,,,911230183751000064,https://twitter.com/CoinDesk/status/911230183751000064
2017-09-06 14:03:16,CoinDesk,,17,62,132,"Litecoin Retreats From All-Time Highs, But Is $100 in Reach? http://bit.ly/2f3hsC2 pic.twitter.com/LwA8RBkGJM",,,,905431207873310720,https://twitter.com/CoinDesk/status/905431207873310720
2017-09-01 10:03:18,CoinDesk,,3,45,79,"Litecoin Surges to New High Amid Buoyant Cryptocurrency Markets http://bit.ly/2eK6BNd pic.twitter.com/D3bYt6AOTc",,,,903558876120965120,https://twitter.com/CoinDesk/status/903558876120965120
2017-08-29 06:00:17,CoinDesk,,0,34,50,"Money Morning – Litecoin Prices Surge 24% as Other Digital Currency Prices Hold Steady http://bit.ly/2vEp1Vd",,,,902410557633986560,https://twitter.com/CoinDesk/status/902410557633986560
2017-08-28 10:43:10,CoinDesk,,5,90,133,"Litecoin Price Surges to New All-Time High Over $60 http://bit.ly/2vkxP7v pic.twitter.com/RUZJqhBQd5",,,,902119357320450048,https://twitter.com/CoinDesk/status/902119357320450048
2017-08-10 14:00:32,CoinDesk,,2,35,51,"Litecoin continues to hover near all-time price highs, even as bitcoin adopts SegWit http://bit.ly/2vOItTP",,,,895646044872167426,https://twitter.com/CoinDesk/status/895646044872167426
2017-08-10 08:02:18,CoinDesk,,8,66,140,"SegWit in the Wild: What Can Bitcoin Learn from Litecoin? http://bit.ly/2urF3Gn pic.twitter.com/ExEwVucoln",,,,895555892464234496,https://twitter.com/CoinDesk/status/895555892464234496
2017-08-09 13:32:16,CoinDesk,,4,37,72,"Litecoin Prices Hold Steady Near $50 as Bitcoin Locks In SegWit http://bit.ly/2vj3JQi pic.twitter.com/tpl9EM3QSP",,,,895276543492206593,https://twitter.com/CoinDesk/status/895276543492206593
2017-08-08 13:11:01,CoinDesk,,15,245,292,"Ether, Litecoin and More: Overstock Now Accepts Cryptocurrencies as Payment http://bit.ly/2vfBNNa pic.twitter.com/GnvhNmteZw",,,,894908808673341441,https://twitter.com/CoinDesk/status/894908808673341441
2017-07-09 08:00:06,CoinDesk,,3,33,71,"Just a testnet? Litecoin looks to boost its developer team http://www.coindesk.com/life-coinbase-can-charlie-lee-keep-litecoins-revival-alive/ …",,,,883958930312974337,https://twitter.com/CoinDesk/status/883958930312974337
2017-07-08 10:00:42,CoinDesk,,7,77,162,"""My vision for litecoin is to have it work closely with bitcoin."" – @SatoshiLite http://www.coindesk.com/life-coinbase-can-charlie-lee-keep-litecoins-revival-alive/ …",,@SatoshiLite,,883626889591566336,https://twitter.com/CoinDesk/status/883626889591566336
2017-07-07 12:03:40,CoinDesk,,8,66,120,"Life After Coinbase: Can Charlie Lee Keep Litecoin's Revival Alive? http://www.coindesk.com/life-coinbase-can-charlie-lee-keep-litecoins-revival-alive/ …pic.twitter.com/SyLORbCjl4",,,,883295448265576448,https://twitter.com/CoinDesk/status/883295448265576448
2017-07-04 02:00:22,CoinDesk,,3,100,120,"Blockchain 101: What is the Difference Between Litecoin and Bitcoin? http://www.coindesk.com/information/comparing-litecoin-bitcoin/ …pic.twitter.com/YTyRP4bFRb",,,,882056460586418176,https://twitter.com/CoinDesk/status/882056460586418176
2017-06-29 06:00:17,CoinDesk,,0,73,86,"Two private preschools in New York City now accept bitcoin, ether and litecoin for tuition payments http://bit.ly/2toq8vL",,,,880304895940800513,https://twitter.com/CoinDesk/status/880304895940800513
2017-06-19 18:46:36,CoinDesk,,2,64,98,"Litecoin's Price Tops $50 to Set New All-Time High http://www.coindesk.com/litecoins-price-tops-50-hit-time-high/ …pic.twitter.com/Y0WWmzOey7",,,,876873867935047680,https://twitter.com/CoinDesk/status/876873867935047680
2017-06-15 06:00:20,CoinDesk,,3,62,100,"Litecoin adopted SegWit just over a month ago and, so far, things are reported to be going smoothly http://www.coindesk.com/litecoin-foundation-reports-no-issues-since-segwit-activation/ …",,,,875231481819521024,https://twitter.com/CoinDesk/status/875231481819521024
2017-06-14 09:04:36,CoinDesk,,3,86,119,"Litecoin Foundation Reports 'No Issues' Since SegWit Activation http://www.coindesk.com/litecoin-foundation-reports-no-issues-since-segwit-activation/ …pic.twitter.com/3mLyEtXo7I",,,,874915463712706561,https://twitter.com/CoinDesk/status/874915463712706561
